pubmedID,allele,Title,JournalName,JournalIssue,Abstract,Year
25626602,"['DQB1*03:03', 'DQB1*05:01', 'DPB1*13:01', 'DRB1*15:02']",HLA class II diversity in HIV-1 uninfected individuals from the placebo arm of the RV144 Thai vaccine efficacy trial.,Tissue antigens,"DictElement({'Volume': '85', 'Issue': '2', 'PubDate': {'Year': '2015', 'Month': 'Feb'}}, attributes={'CitedMedium': 'Internet'})","The RV144 HIV vaccine trial in Thailand elicited antibody responses to the envelope of HIV-1, which correlated significantly with the risk of HIV-1 acquisition. Human leukocyte antigen (HLA) class II molecules are essential in antigen presentation to CD4 T cells for activation of B cells to produce antibodies. We genotyped the classical HLA-DRB1, DQB1, and DPB1 genes in 450 individuals from the placebo arm of the RV144 study to determine the background allele and haplotype frequencies of these genes in this cohort. High-resolution 4 and 6-digit class II HLA typing data was generated using sequencing-based methods. The observed diversity for the HLA loci was 33 HLA-DRB1, 15 HLA-DQB1, and 26 HLA-DPB1 alleles. Common alleles with frequencies greater than 10% were DRB1*07:01, DRB1*09:01, DRB1*12:02, DRB1*15:02, DQB1*02:01/02, DQB1*03:01, DQB1*03:03, DQB1*05:01, DQB1*05:02, DPB1*04:01:01, DPB1*05:01:01, and DPB1*13:01:01. We identified 28 rare alleles with frequencies of less than 1% in the Thai individuals. Ambiguity for HLA-DPB1*28:01 in exon 2 was resolved to DPB1*296:01 by next-generation sequencing of all exons. Multi-locus haplotypes including HLA class I and II loci were reported in this study. This is the first comprehensive report of allele and haplotype frequencies of all three HLA class II genes from a Thai population. A high-resolution genotyping method such as next-generation sequencing avoids missing rare alleles and resolves ambiguous calls. The HLA class II genotyping data generated in this study will be beneficial not only for future disease association/vaccine efficacy studies related to the RV144 study, but also for similar studies in other diseases in the Thai population, as well as population genetics and transplantation studies. ",2015
25945792,['DRB1*15:03'],HLA Class II Antigens and Their Interactive Effect on Perinatal Mother-To-Child HIV-1 Transmission.,PloS one,"DictElement({'Volume': '10', 'Issue': '5', 'PubDate': {'Year': '2015'}}, attributes={'CitedMedium': 'Internet'})","HLA class II antigens are central in initiating antigen-specific CD4+ T cell responses to HIV-1. Specific alleles have been associated with differential responses to HIV-1 infection and disease among adults. This study aims to determine the influence of HLA class II genes and their interactive effect on mother-child perinatal transmission in a drug naïve, Mother-Child HIV transmission cohort established in Kenya, Africa in 1986. Our study showed that DRB concordance between mother and child increased risk of perinatal HIV transmission by three fold (P = 0.00035/Pc = 0.0014, OR: 3.09, 95%CI, 1.64-5.83). Whereas, DPA1, DPB1 and DQB1 concordance between mother and child had no significant influence on perinatal HIV transmission. In addition, stratified analysis showed that DRB1*15:03+ phenotype (mother or child) significantly increases the risk of perinatal HIV-1 transmission. Without DRB1*15:03, DRB1 discordance between mother and child provided 5 fold protection (P = 0.00008, OR: 0.186, 95%CI: 0.081-0.427). However, the protective effect of DRB discordance was diminished if either the mother or the child was DRB1*15:03+ phenotype (P = 0.49-0.98, OR: 0.7-0.99, 95%CI: 0.246-2.956). DRB3+ children were less likely to be infected perinatally (P = 0.0006, Pc = 0.014; OR:0.343, 95%CI:0.183-0.642). However, there is a 4 fold increase in risk of being infected at birth if DRB3+ children were born to DRB1*15:03+ mother compared to those with DRB1*15:03- mother. Our study showed that DRB concordance/discordance, DRB1*15:03, children's DRB3 phenotype and their interactions play an important role in perinatal HIV transmission. Identification of genetic factors associated with protection or increased risk in perinatal transmission will help develop alternative prevention and treatment methods in the event of increases in drug resistance of ARV. ",2015
26031576,['DPB1*13:01'],Genetic susceptibility to cervical squamous cell carcinoma is associated with HLA-DPB1 polymorphisms in Taiwanese women.,"Cancer immunology, immunotherapy : CII","DictElement({'Volume': '64', 'Issue': '9', 'PubDate': {'Year': '2015', 'Month': 'Sep'}}, attributes={'CitedMedium': 'Internet'})","Cervical cancer is a multifactorial disease, and increasing evidence suggests that host immunogenetic background may contribute to its pathogenesis. Genetic variations in human leukocyte antigen (HLA) genes may alter the efficiency of immune response to human papillomavirus (HPV) antigens and have been implicated in the risk of cervical cancer. We investigated whether polymorphisms in the HLA-DPB1 gene were associated with cervical cancer risk in a Taiwanese population. HLA-DPB1 alleles and +550 G/A polymorphism were genotyped in a case-control study of 473 women with cervical squamous cell carcinoma (CSCC) and 676 healthy controls. The presence and genotypes of HPV in CSCC were determined. We found that the DPB1*05:01 and +550 A alleles were associated with decreased and increased risk of CSCC, respectively [odds ratio (OR) = 0.72, Pc = 0.001; OR = 1.25, Pc = 0.03]. In subgroup analysis based on HPV type 16 positivity, significant associations were shown in the DPB1*05:01 and *13:01 alleles (OR = 0.65, Pc = 0.0007; OR = 1.83, Pc = 0.004). Furthermore, the DPB1*05:01-G and *13:01-G haplotypes conferred decreased and increased risk of both CSCC and HPV-16 positive CSCC women, respectively (OR = 0.72, Pc = 0.0009; OR = 0.63, Pc = 0.0004 for DPB1*05:01-G; OR = 1.55, Pc = 0.03; OR = 1.84, Pc = 0.004 for DPB1*13:01-G). A risk haplotype DPB1*02:01-A was also observed in the HPV-16 positive CSCC women (OR = 1.51, Pc = 0.05). These findings suggest that HLA-DPB1 gene is involved in the CSCC development.",2015
26088816,"['DQB1*03:03', 'DQB1*06:03', 'DRB1*13:01', 'DRB1*11:01']",HLA class II susceptibility pattern for type 1 diabetes (T1D) in an Iranian population.,International journal of immunogenetics,"DictElement({'Volume': '42', 'Issue': '4', 'PubDate': {'Year': '2015', 'Month': 'Aug'}}, attributes={'CitedMedium': 'Internet'})","This study aimed to determine the HLA-DRB1/HLA-DQB1 susceptibility and protection pattern for type 1 diabetes (T1D) in a population from Hamadan, north-west of Iran. A total of 133 patients with T1D were tested for HLA-DRB1 and HLA-DQB1 alleles using PCR-SSP compared to 100 ethnic-matched healthy controls. Alleles and haplotypes frequencies were compared between both groups. The most susceptible alleles for disease were HLA-DRB1*03:01, DRB1*04:02, DQB1*02:01 and DQB1*03:02, and protective alleles were HLA-DRB1*07:01, *11:01, *13:01, *14:01 and DRB1*15 and HLA-DQB1*06:01, *06:02 and *06:03. Haplotype analysis revealed that patients with T1D had higher frequencies of DRB1*03:01-DQB1*02:01 (OR = 4.86, P < 10(-7) ) and DRB1*04:02-DQB1*03:02 (OR = 9.93, P < 10(-7) ) and lower frequencies of DRB1*07:01-DQB1*02:01 (P = 0.0005), DRB1*11:01-DQB1*03:01 (P = 0.001), DRB1*13:01-DQB1*06:03 (P = 0.002) and DRB1*15-DQB1*06:01 (P = 0.001) haplotypes compared to healthy controls. Heterozygote combination of both susceptible haplotypes (DR3/DR4) confers the highest risk for T1D (RR = 18.80, P = 4 × 10(-5) ). Additionally, patients with homozygote diplotype, DR3/DR3 and DR4/DR4, showed a similar risk with less extent to heterozygote combination (P = 0.0004 and P = 0.01, respectively). Our findings not only confirm earlier reports from Iranians but also are in line with Caucasians and partly with Asians and some African patients with T1D. Remarkable differences were the identification of DRB1*04:01-DQB1*03:02, DRB1*07:01-DQB1*03:03 and DRB1*16-DQB1*05:02 as neutral and DRB1*13:01-DQB1*06:03 as the most protective haplotypes in this study. ",2015
27091392,"['DPB1*09:01', 'DQB1*06:04', 'DRB1*13:02', 'DRB1*15:02']",Understanding of HLA-conferred susceptibility to chronic hepatitis B infection requires HLA genotyping-based association analysis.,Scientific reports,"DictElement({'Volume': '6', 'PubDate': {'Year': '2016', 'Month': 'Apr', 'Day': '19'}}, attributes={'CitedMedium': 'Internet'})","Associations of variants located in the HLA class II region with chronic hepatitis B (CHB) infection have been identified in Asian populations. Here, HLA imputation method was applied to determine HLA alleles using genome-wide SNP typing data of 1,975 Japanese individuals (1,033 HBV patients and 942 healthy controls). Together with data of an additional 1,481 Japanese healthy controls, association tests of six HLA loci including HLA-A, C, B, DRB1, DQB1, and DPB1, were performed. Although the strongest association was detected at a SNP located in the HLA-DP locus in a SNP-based GWAS using data from the 1,975 Japanese individuals, HLA genotyping-based analysis identified DQB1*06:01 as having the strongest association, showing a greater association with CHB susceptibility (OR = 1.76, P = 6.57 × 10(-18)) than any one of five HLA-DPB1 alleles that were previously reported as CHB susceptibility alleles. Moreover, HLA haplotype analysis showed that, among the five previously reported HLA-DPB1 susceptibility and protective alleles, the association of two DPB1 alleles (DPB1*09:01, and *04:01) had come from linkage disequilibrium with HLA-DR-DQ haplotypes, DRB1*15:02-DQB1*06:01 and DRB1*13:02-DQB1*06:04, respectively. The present study showed an example that SNP-based GWAS does not necessarily detect the primary susceptibility locus in the HLA region. ",2016
27166610,"['DQB1*03:03', 'DRB1*13:02']",Protective Role of HLA-DRB1*13:02 against Microscopic Polyangiitis and MPO-ANCA-Positive Vasculitides in a Japanese Population: A Case-Control Study.,PloS one,"DictElement({'Volume': '11', 'Issue': '5', 'PubDate': {'Year': '2016'}}, attributes={'CitedMedium': 'Internet'})","Among antineutrophil cytoplasmic antibody (ANCA)-associated vasculitides (AAV), granulomatosis with polyangiitis (GPA) and proteinase 3-ANCA-positive AAV (PR3-AAV) are prevalent in European populations, while microscopic polyangiitis (MPA) and myeloperoxidase-ANCA-positive AAV (MPO-AAV) are predominant in the Japanese. We previously demonstrated association of DRB1*09:01-DQB1*03:03 haplotype, a haplotype common in East Asians but rare in the European populations, with MPA/MPO-AAV, suggesting that a population difference in HLA-class II plays a role in the epidemiology of this disease. To gain further insights, we increased the sample size and performed an extended association study of DRB1 and DPB1 with AAV subsets in 468 Japanese patients with AAV classified according to the European Medicines Agency algorithm (MPA: 285, GPA: 92, eosinophilic GPA [EGPA]: 56, unclassifiable: 35) and 596 healthy controls. Among these patients, 377 were positive for MPO-ANCA and 62 for PR3-ANCA. The significance level was set at α = 3.3x10-4 by applying Bonferroni correction. The association of DRB1*09:01 with MPO-AAV was confirmed (allele model, P = 2.1x10-4, odds ratio [OR] = 1.57). Protective association of DRB1*13:02 was detected against MPO-AAV (allele model, P = 2.3x10-5, OR = 0.42) and MPA (dominant model, P = 2.7x10-4, OR = 0.43). A trend toward increased frequency of DPB1*04:01, the risk allele for GPA in European populations, was observed among Japanese patients with PR3-AAV when conditioned on DRB1*13:02 (Padjusted = 0.0021, ORadjusted = 3.48). In contrast, the frequency of DPB1*04:01 was decreased among Japanese patients with MPO-AAV, and this effect lost significance when conditioned on DRB1*13:02 (Padjusted = 0.16), suggesting that DRB1*13:02 or other allele(s) in linkage disequilibrium may be responsible for the protection. The differential association of DPB1*04:01 with PR3-AAV and MPO-AAV and difference in DPB1*04:01 allele frequencies between populations supported the hypothesis that the HLA-class II population difference may account in part for these epidemiologic characteristics. Furthermore, taken together with our previous observations, the haplotype carrying DRB1*13:02 was suggested to be a shared protective factor against multiple autoimmune diseases.",2016
27178774,"['DRB1*01:02', 'DQB1*05:01']",Differential HLA class I and class II associations in pemphigus foliaceus and pemphigus vulgaris patients from a prevalent Southeastern Brazilian region.,Journal of autoimmunity,"DictElement({'Volume': '72', 'PubDate': {'Year': '2016', 'Month': '08'}}, attributes={'CitedMedium': 'Internet'})","Genetic factors, particularly those concerning HLA class II, have been associated with the pathogenesis of pemphigus. Taking advantage of an area where pemphigus foliaceus (PF) and pemphigus vulgaris (PV) are prevalent in the northeastern region of the state of São Paulo, Southeastern Brazil, we have studied the HLA class I (A, B and C) and class II (DRB1 and DQA1/DQB1) profiles in 86 and 83 patients with PF and PV, respectively, as compared with 1592 controls from the same region. Among all the HLA alleles described herein, the more prevalent susceptibility alleles for PF were HLA-A*11, 33, -B*14; -DRB1*01:01, *01:02; -DQA1*01:02; and -DQB1*05:01. In PV patients, the HLA-B*38; -C*12; -DRB1*04:02, *08:04, *14:01, *14:04; -DQA1*03:01; and -DQB1*03:02 and *05:03 alleles were associated with susceptibility. The HLA-DRB1*01:02 allele and the HLA-DRB1*01-DQA1*01-DQB1*05 haplotype in PF patients and the HLA-DRB1*04:02 and *14:01 alleles and the HLA-DRB1*14-DQA1*01-DQB1*05 haplotype in PV patients were related with the highest etiologic fraction values. Distinct genetic patterns and not yet described HLA susceptibility/protection alleles/haplotypes profiles have been observed in this series. Our findings corroborate the differential genetic markers in PF and PV in an area where pemphigus is prevalent but not yet reported.",2016
27485170,['DQB1*05:01'],Higher frequencies of HLA DQB1*05:01 and anti-glycosphingolipid antibodies in a cluster of severe Guillain-Barré syndrome.,Journal of neurology,"DictElement({'Volume': '263', 'Issue': '10', 'PubDate': {'Year': '2016', 'Month': 'Oct'}}, attributes={'CitedMedium': 'Internet'})","Few regional and seasonal Guillain-Barré syndrome (GBS) clusters have been reported so far. It is unknown whether patients suffering from sporadic GBS differ from GBS clusters with respect to clinical and paraclinical parameters, HLA association and antibody response to glycosphingolipids and Campylobacter jejuni (Cj). We examined 40 consecutive patients with GBS from the greater Munich area in Germany with 14 of those admitted within a period of 3 months in fall 2010 defining a cluster of GBS. Sequencing-based HLA typing of the HLA genes DRB1, DQB1, and DPB1 was performed, and ELISA for anti-glycosphingolipid antibodies was carried out. Clinical and paraclinical findings (Cj seroreactivity, cerebrospinal fluid parameters, and electrophysiology) were obtained and analyzed. GBS cluster patients were characterized by a more severe clinical phenotype with more patients requiring mechanical ventilation and higher frequencies of autoantibodies against sulfatide, GalC and certain ganglioside epitopes (54 %) as compared to sporadic GBS cases (13 %, p = 0.017). Cj seropositivity tended to be higher within GBS cluster patients (69 %) as compared to sporadic cases (46 %, p = 0.155). We noted higher frequencies of HLA class II allele DQB1*05:01 in the cluster cohort (23 %) as compared to sporadic GBS patients (3 %, p = 0.019). Cluster of severe GBS was defined by higher frequencies of autoantibodies against glycosphingolipids. HLA class II allele DQB1*05:01 might contribute to clinical worsening in the cluster patients. ",2016
27511726,"['DRB1*13:02', 'DRB1*15:02']","HLA-A, HLA-B and HLA-DRB1 allele and haplotype frequencies of 10 918 Koreans from bone marrow donor registry in Korea.",International journal of immunogenetics,"DictElement({'Volume': '43', 'Issue': '5', 'PubDate': {'Year': '2016', 'Month': 'Oct'}}, attributes={'CitedMedium': 'Internet'})","The human leucocyte antigen (HLA) system is the most polymorphic genetic system in humans, and HLA matching is crucial in organ transplantation, especially in hematopoietic stem cell transplantation. We investigated HLA-A, HLA-B and HLA-DRB1 allele and haplotype frequencies at allelic level in 10 918 Koreans from bone marrow donor registry in Korea. Intermediate resolution HLA typing was performed using Luminex technology (Wakunaga, Japan), and additional allelic level typing was performed using PCR-single-strand conformation polymorphism method and/or sequence-based typing (Abbott Molecular, USA). Allele and haplotype frequencies were calculated by direct counting and maximum likelihood methods, respectively. A total of 39 HLA-A, 66 HLA-B and 47 HLA-DRB1 alleles were identified. High-frequency alleles found at a frequency of ≥5% were 6 HLA-A (A*02:01, *02:06, *11:01, *24:02, *31:01 and *33:03), 6 HLA-B (B*15:01, *35:01, *44:03, *51:01, 54:01 and *58:01) and 8 HLA-DRB1 (DRB1*01:01, *04:05, *04:06, *07:01, *08:03, *09:01, *13:02 and *15:01) alleles. At each locus, A*02, B*15 and DRB1*14 generic groups were most diverse at allelic level, consisting of 9, 12 and 11 different alleles, respectively. A total of 366, 197 and 21 different HLA-A-B-DRB1 haplotypes were estimated with frequencies of ≥0.05%, ≥0.1% and ≥0.5%, respectively. The five most common haplotypes with frequencies of ≥2.0% were A*33:03-B*44:03-DRB1*13:02 (4.97%), A*33:03-B*58:01-DRB1*13:02, A*33:03-B*44:03-DRB1*07:01, A*24:02-B*07:02-DRB1*01:01 and A*24:02-B*52:01-DRB1*15:02. Among 34 serologic HLA-A-B-DR haplotypes with frequencies of ≥0.5%, 17 haplotypes revealed allele-level diversity and majority of the allelic variation was arising from A2, A26, B61, B62, DR4 and DR14 specificities. Haplotype diversity obtained in this study is the most comprehensive data thus far reported in Koreans, and the information will be useful for unrelated stem cell transplantation as well as for disease association studies. ",2016
27709802,"['DRB1*13:03', 'DRB1*01:02']",Association of HLA alleles and haplotypes with CYP21A2 gene p. V282L mutation in the Croatian population.,HLA,"DictElement({'Volume': '88', 'Issue': '5', 'PubDate': {'Year': '2016', 'Month': '11'}}, attributes={'CitedMedium': 'Internet'})","The CYP21A2 mutations that are in linkage disequilibrium with particular HLA-A, -B, -DRB1 alleles/haplotypes, cause deficiency of the 21-hydroxylase enzyme (21-OHD) and account for the majority of congenital adrenal hyperplasia (CAH) cases. The aim of this study was to investigate those associations with the p.V282L mutation linked to the non-classical (NC) form of CAH among Croatians. The study included parents of patients with the NC form of CAH, positive for the p.V282L mutation (N = 55) and cadaveric donor samples (N = 231). All subjects were HLA-A, -B, and -DRB1 typed and tested for the presence of the p.V282L mutation. Among parents of patients, 92.73% of subjects were positive for the B*14:02 allele and almost half of them carried the HLA-A*33:01-B*14:02-DRB1*01:02 haplotype. Among cadaveric samples 77 out of 96 subjects positive for the B*14:02 allele had the p.V282L mutation. Among them, 37 were positive for the HLA-A*33:01-B*14:02-DRB1*01:02 haplotype, 23 had the HLA-A*33:01-B*14:02-DRB1*03:01 haplotype, 8 had the B*14:02-DRB1*01:02 combination and 5 were carrying the HLA-A*68:02-B*14:02-DRB1*13:03 haplotype. Only 4 of these subjects were positive for the B*14:02 allele. HLA-B*14:02 was the only single allele with association that reached statistically significant P value (RR = 12.00; P = 0.0024). Haplotypes B*14:02-DRB1*01:02 (P < 0.001) and HLA-A*68:02-B*14:02-DRB1*13:03 (P < 0.001) as well as HLA-A*33:01-B*14:02-DRB1*01:02 and HLA-A*33:01-B*14:02-DRB1*03:01 showed high relative risks (RR = 45.00, RR = 41.63 and RR = 36.96, respectively). Our data support the previously documented association of the HLA-A*33:01-B*14:02-DRB1*01:02 haplotype with the p.V282L mutation, but also point out a high frequency of the p.V282L mutation among Croatians with HLA-A*33:01-B*14:02-DRB1*03:01 and HLA-A*68:02-B*14:02-DRB1*13:03 haplotypes.",2016
28083619,"['DRB1*16:01', 'DRB1*11:04']","Determination of HLA-A, -B, and -DRB1 Allele and Haplotype Frequencies in the Croatian Population Based on a Family Study.",Archivum immunologiae et therapiae experimentalis,"DictElement({'Volume': '64', 'Issue': 'Suppl 1', 'PubDate': {'Year': '2016', 'Month': 'Dec'}}, attributes={'CitedMedium': 'Internet'})","In the present study, HLA allele and haplotype frequencies among Croatian families were investigated to evaluate valuable information about HLA genotypes and to compare them with data from the Croatian Bone Marrow Donor Registry (CBMDR). A total of 350 families which have been typed for the purpose of HSCT were included. All individuals were tested using PCR-SSO or PCR-SSP methods for HLA-A, -B, and -DRB1 alleles. The HLA-A-B-DRB1 haplotypes were determined by segregation and directly counted. A total of 30 HLA-A, 54 HLA-B, and 38 HLA-DRB1 alleles and 716 different HLA-A-B-DRB1 haplotypes were identified. Of these, the three most frequent alleles at HLA-A, -B, and -DRB1 loci, respectively, were A*02:01 (30.39%), A*11:01 (13.37%), A*24:02 (10.91%); B*51:01 (12.48%), B*18:01 (8.35%), B*08:01 (8.06%); DRB1*03:01 (11.20%), DRB1*01:01 (9.84%), DRB1*16:01 (9.63%). The following HLA alleles were detected only once: A*02:09, A*24:03, A*24:04, A*24:07; B*07:04, B*15:07, B*15:08, B*39:04, B*39:10, B*39:24, B*40:04; DRB1*08:03, DRB1*11:06, DRB1*13:32, DRB1*14:05. Five most frequent haplotypes were: A*01:01-B*08:01-DRB1*03:01 (5.34%), A*02:01-B*18:01-DRB1*11:04 (1.57%), A*02:01-B*27:02-DRB1*16:01 (1.50%), A*02:01-B*27:05-DRB1*01:01 (1.42%) and A*02:01-B*44:02:01G-DRB1*16:01 (1.28%). The haplotype frequencies based on the family study were compared with the frequencies from CBMDR, and similar results were obtained for all except for the HLA-A*26:01-B*38:01-DRB1*04:02 haplotype. A significantly higher frequency (P = 0.0017) of this haplotype was observed among family individuals. Nine haplotypes were unique and data about their frequencies do not exist in current databases. The data obtained in this study could be useful for anthropology, transplantation and disease association studies.",2016
28107781,"['DQB1*06:04', 'DRB1*13:02']",Rare human leukocyte antigen genotype in two siblings with type 1 diabetes in a Japanese family clustered with type 1 diabetes.,Journal of diabetes investigation,"DictElement({'Volume': '8', 'Issue': '6', 'PubDate': {'Year': '2017', 'Month': 'Nov'}}, attributes={'CitedMedium': 'Internet'})","Multiplex families with type 1 diabetes are important for identification of rare variants that cannot be identified in case-control association studies. The very low incidence of type 1 diabetes in the Japanese population, however, makes identification of such families difficult. We identified a Japanese family in which three members developed type 1 diabetes, and studied the genotype of the human leukocyte antigen. All three members with type 1 diabetes had the DRB1*08:02-DQB1*03:02 haplotype, which is specific to the Asian population and strongly susceptible for type 1 diabetes. In particular, a proband and his sister had the same genotype, DRB1*08:02-DQB1*03:02/DRB1*08:02-DQB1*03:02, which is extremely rare even in the Japanese population. Both parents also had DRB1*08:02-DQB1*03:02, but in combination with different human leukocyte antigen haplotypes. Weakly susceptible DRB1*13:02-DQB1*06:04 was present in the affected mother, and resistant DRB1*15:01-DQB1*06:02 in the unaffected father. These data suggest DRB1*08:02-DQB1*03:02 to be a contributing factor for familial clustering of type 1 diabetes in this family.",2017
28129483,['DRB1*11:01'],Association of Anti-3-Hydroxy-3-Methylglutaryl-Coenzyme A Reductase Autoantibodies With DRB1*07:01 and Severe Myositis in Juvenile Myositis Patients.,Arthritis care & research,"DictElement({'Volume': '69', 'Issue': '7', 'PubDate': {'Year': '2017', 'Month': '07'}}, attributes={'CitedMedium': 'Internet'})","Autoantibodies recognizing 3-hydroxy-3-methylglutaryl-coenzyme A reductase (HMGCR) are associated with statin exposure, the HLA allele DRB1*11:01, and necrotizing muscle biopsies in adult myositis patients. The aim of this study was to characterize the features of juvenile anti-HMGCR-positive myositis patients.",2017
