pubmedID,allele,Title,JournalName,JournalIssue,Abstract,Year
21214530,['DRB1*10:01'],The complete genomic sequence of HLA-DRB1*10:01:01 was identified by sequencing in a Han Chinese individual.,Tissue antigens,"DictElement({'Volume': '77', 'Issue': '2', 'PubDate': {'Year': '2011', 'Month': 'Feb'}}, attributes={'CitedMedium': 'Internet'})","The complete genomic sequence of HLA (human leukocyte antigen)-DRB1*10:01:01, including a part of the promoter and 3'-downstream sequence, was identified by sequencing in a Han Chinese male donor.",2011
21833018,['DRB1*15:03'],Black patients of African descent and HLA-DRB1*15:03 frequency overrepresented in epidermolysis bullosa acquisita.,The Journal of investigative dermatology,"DictElement({'Volume': '131', 'Issue': '12', 'PubDate': {'Year': '2011', 'Month': 'Dec'}}, attributes={'CitedMedium': 'Internet'})","Epidermolysis bullosa acquisita (EBA) is a rare autoimmune bullous disease (AIBD). However, higher EBA incidence and predisposing genetic factor(s) involving an HLA haplotype have been suspected in some populations. This retrospective study assessed the overrepresentation of black patients with EBA, its link with HLA-DRB1*15:03, and their clinical and immunological characteristics. Between 2005 and 2009, 7/13 (54%) EBA and 6/183 (3%) other-AIBD patients seen consecutively in our department were black (P=10(-6)); moreover 7/13 (54%) black patients and 6/183 (3%) white patients had EBA (P=10(-6)). In addition, between 1983 and 2005, 12 black patients had EBA. Finally, among the 19 black EBA patients, most of them had very atypical clinical presentations, 9 were natives of sub-Saharan Africa, 1 from Reunion Island, 7 from the West Indies, and 2 were of mixed ancestry. HLA-DRB1*15:03 allelic frequencies were 50% for African patients, significantly higher than the control population (P<10(-3)), and 21% for the West Indians (nonsignificant). High EBA frequencies have already been reported in American blacks significantly associated with the HLA-DR2. In conclusion, black-skinned patients developing EBA seem to have a genetic predisposition, and EBA should be suspected systematically for every AIBD seen in this population.",2011
22471586,['DPB1*09:01'],Associations between six classical HLA loci and rheumatoid arthritis: a comprehensive analysis.,Tissue antigens,"DictElement({'Volume': '80', 'Issue': '1', 'PubDate': {'Year': '2012', 'Month': 'Jul'}}, attributes={'CitedMedium': 'Internet'})","Although the HLA region contributes to one-third of the genetic factors affecting rheumatoid arthritis (RA), there are few reports on the association of the disease with any of the HLA loci other than the DRB1. In this study we examined the association between RA and the alleles of the six classical HLA loci including DRB1. Six HLA loci (HLA-A, -B, -C, -DRB1, -DQB1 and -DPB1) of 1659 Japanese subjects (622 cases; 488 anti-cyclic citrullinated peptides (CCP) antibody (Ab) positive (82.6%); 103 anti-CCP Ab negative (17.4%); 31 not known and 1037 controls) were genotyped. Disease types and positivity/negativity for CCP autoantibodies were used to stratify the cases. Statistical and genetic assessments were performed by Fisher's exact tests, odds ratio, trend tests and haplotype estimation. None of the HLA loci were significantly associated with CCP sero-negative cases after Bonferroni correction and we therefore limited further analyses to using only the anti CCP-positive RA cases and both anti-CCP positive and anti-CCP negative controls. Some alleles of the non-DRB1 HLA loci showed significant association with RA, which could be explained by linkage disequilibrium with DRB1 alleles. However, DPB1*02:01, DPB1*04:01 and DPB1*09:01 conferred RA risk/protection independently from DRB1. DPB1*02:01 was significantly associated with the highly erosive disease type. The odds ratio of the four HLA-loci haplotypes with DRB1*04:05 and DQB1*04:01, which were the high-risk HLA alleles in Japanese, varied from 1.01 to 5.58. C*07:04, and B*15:18 showed similar P-values and odds ratios to DRB1*04:01, which was located on the same haplotype. This haplotype analysis showed that the DRB1 gene as well as five other HLA loci is required for a more comprehensive understanding of the genetic association between HLA and RA than analyzing DRB1 alone.",2012
23278646,"['DRB1*11:04', 'DRB1*11:01']",HLA-DRB1 and HLA-DQB1 genes on susceptibility to and protection from allergic bronchopulmonary aspergillosis in patients with cystic fibrosis.,Microbiology and immunology,"DictElement({'Volume': '57', 'Issue': '3', 'PubDate': {'Year': '2013', 'Month': 'Mar'}}, attributes={'CitedMedium': 'Internet'})","Allergic bronchopulmonary aspergillosis (ABPA) is a hypersensitivity pulmonary disease that affects both patients with cystic fibrosis (CF) and those with asthma. HLA-DRB1 alleles have previously been associated with ABPA-CF susceptibility; however, HLA-DQB1 allele associations have not been clearly established. The aim of the present study was to investigate HLA class II associations in patients with ABPA-CF and determine their roles in susceptibility or protection. Patients with ABPA-CF, patients with CF without ABPA, patients with asthma without ABPA (AST), and healthy controls were included in this study. DNA was extracted by automatic extractor. HLA-DRB1 and -DQB1 genotyping was performed by the Luminex PCR-SSOP method (One Lambda, Canoga Park, CA, USA). Allele specific PCR-SSP was also performed by high-resolution analysis (One Lambda). Statistical analysis was performed with SSPS and Arlequin software. Both HLA-DRB1*5:01 and -DRB1*11:04 alleles occurred with greater frequency in patients with ABPA-CF than in those with AST and CF and control subjects, corroborating previously published data. On the other hand, analysis of haplotypes revealed that almost all patients with ABPA-CF lacking DRB1*15:01 or DRB1*11:04 carry either DRB1*04, DRB1*11:01, or DRB1*07:01 alleles. In the HLA-DQB1 region, the HLA-DQB1*06:02 allele occurred more frequently in patients with ABPA-CF than in those with AST and CF and healthy controls, whereas HLA-DQB1*02:01 occurred less frequently in patients with ABPA-CF. These data confirm that there is a correlation between HLA-DRB1*15:01, -DRB1*11:04, DRB1*11:01, -DRB1*04 and -DRB1*07:01 alleles and ABPA-CF susceptibility and suggest that HLA-DQB1*02:01 is an ABPA-CF resistance allele.",2013
23376085,['DRB1*01:02'],21-Hydroxylase gene mutant allele CYP21A2*15 strongly linked to the resistant HLA haplotype B*14:02-DRB1*01:02 in chronic Chagas disease.,Human immunology,"DictElement({'Volume': '74', 'Issue': '6', 'PubDate': {'Year': '2013', 'Month': 'Jun'}}, attributes={'CitedMedium': 'Internet'})","We previously reported protective haplotype HLA-B*14:02-DRB1*01:02 against chronic Chagas disease in Bolivia. The V281L mutant allele of the 21-Hydroxylase gene, CYP21A2*15, is reported to be located in the Class III region of the Human leukocyte antigen region and linked to the haplotype HLA-B*14:02-DRB1*01:02. The mutant allele might play a primary role in the pathogenesis of chronic Chagas disease in the associated HLA region. We analyzed the frequency of this allele in the same subjects for the previous one. The statistical analysis showed a significant association of the CYP21A2*15 with resistance to severe chronic Chagas disease (OR=0.207273; Pv=0.0041). However, there is no significant tendency of the mutant gene contribution to the resistance after the elimination of the HLA-B*14:02-DRB1*01:02 linked mutants (OR=0.38; Pv=0.1533). Although the frequency of the CYP21A2*15 was small, we found no primary contribution of this mutation to the protection against chronic Chagas disease.",2013
23404077,['DRB1*15:02'],Association of HLA-DRB1*15:02 and DRB5*01:02 allele with the susceptibility to systemic sclerosis in Thai patients.,Rheumatology international,"DictElement({'Volume': '33', 'Issue': '8', 'PubDate': {'Year': '2013', 'Month': 'Aug'}}, attributes={'CitedMedium': 'Internet'})","A genetic study, particularly in HLA-DRs, has never been performed in Thai patients with systemic sclerosis (SSc). This study was performed to investigate the association between the HLA-DR series in Thai SSc patients. HLA-DR subtypes were determined in 50 Thai SSc patients and 99 healthy controls (HCs). All SSc patients met the ACR classification criteria for SSc. HLA-DR typing was performed using INNO-LiPA HLA-DRB Decoder kits (INNOGENETICS) and reconfirmed using MICRO SSP HLA DNA Typing kits (ONE LAMBDA). The allele frequency (AF) of HLA-DR*15, compared with HC, was significantly higher in all SSc patients (41.0 vs 21.7%, Pc = 0.0083) and SSc patients with anti-Scl70 antibody positive (anti-Scl70+) (47.1%, Pc = 0.0018). Among the HLA-DR*15 alleles, the AF of the DRB1*15:02 was increased significantly in all SSc patients (29.0 vs 12.6%, Pc = 0.0219) and SSc patients with anti-Scl70+ (32.4 vs 12.6%, Pc = 0.0196). The AF of the HLA-DRB5*01:02 allele was also increased in all SSc patients (27.0 vs 12.6%, Pc = 0.0166) and in SSc patients with anti-Scl70+ (29.4%, Pc = 0.0124). The AF of the DR*04 was significantly lower in the SSc patients (1.0 vs 9.6%, Pc = 0.0399). However, the AF of the DRB1*15:02 and DRB5*01:02 was not different among SSc patients with or without clinical manifestations (pulmonary fibrosis, digital pitting scar, sclerodactyly, myositis, and sicca symptoms). In addition, there was no significant association between clinical manifestations among individuals who carried HLA-DRB1*15:02 or DRB5*01:02. HLA-DRB1*15:02 and DRB5*01:02 alleles were significantly elevated in Thai SSc patients, especially in those with anti-Scl70+. The HLA-DRB1*04 was a protective allele against Thai SSc patients.",2013
23443026,['DQB1*06:03'],HLA-DQB1*02 and DQB1*06:03P are associated with peanut allergy.,European journal of human genetics : EJHG,"DictElement({'Volume': '21', 'Issue': '10', 'PubDate': {'Year': '2013', 'Month': 'Oct'}}, attributes={'CitedMedium': 'Internet'})","Peanut allergy (PA) is a common and serious food allergy and its prevalence has increased in the past decade. Although there is strong evidence of inheritance, the genetic causes of this disease are not well understood. Previously, a large-scale genome-wide association study described an association between human leukocyte antigen (HLA)-DQB1 and asthma; the aim of this study was to evaluate the association between HLA-DQB1 and PA. Genotypic and allelic profiles were established for 311 Caucasian members of a well-described Canadian group of children with PA and 226 Caucasian controls. Firth's logistic regression analyses showed associations between HLA-DQB1 alleles and PA for DQB1*02 (P=1.1 × 10(-8), odds ratio (OR)=0.09 (CI=0.03-0.23)) and DQB1*06:03P alleles (P=2.1 × 10(-2), OR=2.82 (CI=1.48-5.45)). This study of HLA in PA demonstrates specific association between two allelic groups of the HLA-DQB1 gene (DQB1*02 and DQB1*06:03P) and PA, highlighting its possible role in the development of this disease. ",2013
23543758,['DRB1*11:01'],Differential binding of pyruvate dehydrogenase complex-E2 epitopes by DRB1*08:01 and DRB1*11:01 Is predicted by their structural motifs and correlates with disease risk.,"Journal of immunology (Baltimore, Md. : 1950)","DictElement({'Volume': '190', 'Issue': '9', 'PubDate': {'Year': '2013', 'Month': 'May', 'Day': '01'}}, attributes={'CitedMedium': 'Internet'})","DRB1*08:01 (DR0801) and DRB1*11:01 (DR1101) are highly homologous alleles that have opposing effects on susceptibility to primary biliary cirrhosis (PBC). DR0801 confers risk and shares a key feature with other HLA class II alleles that predispose to autoimmunity: a nonaspartic acid at beta57. DR1101 is associated with protection from PBC, and its sequence includes an aspartic acid at beta57. To elucidate a mechanism for the opposing effects of these HLA alleles on PBC susceptibility, we compared the features of epitopes presented by DR0801 and DR1101. First, we identified DR0801- and DR1101-restricted epitopes within multiple viral Ags, observing both shared and distinct epitopes. Because DR0801 is not well characterized, we deduced its motif by measuring binding affinities for a library of peptides, confirming its key features through structural modeling. DR0801 was distinct from DR1101 in its ability to accommodate charged residues within all but one of its binding pockets. In particular, DR0801 strongly preferred acidic residues in pocket 9. These findings were used to identify potentially antigenic sequences within PDC-E2 (an important hepatic autoantigen) that contain a DR0801 motif. Four peptides bound to DR0801 with reasonable affinity, but only one of these bound to DR1101. Three peptides, PDC-E2145-159, PDC-E2(249-263), and PDC-E2(629-643), elicited high-affinity T cell responses in DR0801 subjects, implicating these as likely autoreactive specificities. Therefore, the unique molecular features of DR0801 may lead to the selection of a distinct T cell repertoire that contributes to breakdown of self-tolerance in primary biliary cirrhosis, whereas those of DR1101 promote tolerance.",2013
23628399,['DRB1*11:01'],Associations of HLA-DRB1 and -DQB1 alleles with severe recurrent respiratory papillomatosis in Korean patients.,Human immunology,"DictElement({'Volume': '74', 'Issue': '8', 'PubDate': {'Year': '2013', 'Month': 'Aug'}}, attributes={'CitedMedium': 'Internet'})","Recurrent respiratory papillomatosis (RRP) is characterized by frequent recurrences of papilloma of the larynx with significant morbidity. It is caused by human papillomavirus (HPV) types 6 and 11. Some associations of HLA genes with RRP have been reported, mainly in Caucasians. We performed HLA class II (DRB1 and DQB1) genotyping using Dynal RELI™ HLA-DRB1 SSO kit and PCR-single strand conformation polymorphism on 22 Korean patients with severe RRP and 207 healthy controls. The gene frequencies of HLA-DRB1*11:01 (18.2% vs 3.6%, p=0.0006, pc=0.02, odds ratio [OR]=5.9) and DQB1*03:01 (36.4% vs 14.5%, p=0.0009, pc=0.01, OR=3.4) and the haplotype frequency of DRB1*11:01-DQB1*03:01 (15.9% vs 3.6%, p=0.003, OR=5.0) was higher in RRP patients than controls. DRB1*11:01 and DRB1*11:01-DQB1*03:01 haplotype were strongly associated with disease susceptibility to severe RRP in Koreans.",2013
23934009,"['DQB1*06:04', 'DRB1*13:02']",HLA-DPB1*04:01 allele is associated with non-obstructive azoospermia in Japanese patients.,Human genetics,"DictElement({'Volume': '132', 'Issue': '12', 'PubDate': {'Year': '2013', 'Month': 'Dec'}}, attributes={'CitedMedium': 'Internet'})","Azoospermia is defined by absence of sperm in the semen and can either be caused by obstruction of the seminal tract (obstructive azoospermia) or by defects in spermatogenesis (non-obstructive azoospermia, NOA). Previous studies reported that specific alleles and single nucleotide polymorphisms (SNPs) in the human leukocyte antigen (HLA) region were associated with NOA in East Asians. We attempt to expand upon previous findings by genotyping more HLA genes and to replicate SNP associations by focusing on Japanese NOA patients. HLA typing of six genes (HLA-A, -B, -C, -DRB1, -DQB1, and -DPB1) was done on 355 NOA patients using SSO-Luminex assay while genotyping of two previously reported SNPs (rs498422 and rs3129878) was done on 443 patients and 544 fertile males using TaqMan assay. Association between the HLA alleles and SNP with NOA was assessed with Chi squared and logistic regression tests. We found that HLA-DPB1*04:01 [corrected p value, P(c) 7.13 × 10(-6); odds ratio (OR) 2.52], DRB1*13:02 (P(c) 4.93 × 10(-4), OR 1.97), DQB1*06:04 (P(c) 8.94 × 10(-4), OR 1.91) and rs3129878 (p value 3.98 × 10(-4); OR 1.32) showed significant association with NOA, however, these loci are in linkage disequilibrium with each other. The conditional logistic regression tests showed that DPB1*04:01 is independently associated with NOA, confirming the involvement of the HLA region in the etiology of NOA in Japanese patients.",2013
24291122,"['DRB1*13:01', 'DRB1*11:01']",Genetic susceptibility to multicase hypersensitivity pneumonitis is associated with the TNF-238 GG genotype of the promoter region and HLA-DRB1*04 bearing HLA haplotypes.,Respiratory medicine,"DictElement({'Volume': '108', 'Issue': '1', 'PubDate': {'Year': '2014', 'Month': 'Jan'}}, attributes={'CitedMedium': 'Internet'})","Hypersensitivity Pneumonitis (HP) is a lung inflammatory disorder caused by inhalation of organic particles by a susceptible host. Since only a small proportion of individuals exposed to HP-related antigens develop the disease, a genetic predisposition is largely suspected. However, studies regarding genetic susceptibility in this disease are scanty. We have previously found evidence supporting increased risk associated to the major histocompatibility complex (MHC) in sporadic HP. In the present study, we conducted a family-based research that includes nine multicase families with at least two related HP patients (RHP). We evaluated 19 RHP individuals, 25 additional healthy first-degree relatives (REA) and 246 healthy unrelated individuals (HUI). HLA class II typing (DRB1/3/4/5, DQA1, DQB1, DPA1, DPB1, DMA and DMB), and -863, -308 and -238 polymorphisms in the promoter region of TNF-α were performed by PCR based methods. We identified an increased frequency of HLA-DRB1*04:07, DRB1*04:05, DRB1*11:01 and DRB1*13:01 alleles in RHP individuals compared to healthy controls (p < 0.05). A significant higher frequency of DRB1*04:07-DQB1*03:02, DRB1*04:05-DQB1*03:02, and DRB1*04:03-DQB1*03:02 haplotypes was also detected in the group of patients. Likewise, TNF-238 GG genotype was more frequent in the RHP group as compared to REA (p = 0.01, OR = 7.2). Finally, the combination of HLA-DRB1*04 alleles and TNF-238 GG was significantly increased in the RHP group (p = 0.01, OR = 6.93). These findings indicate that genes located within the MHC region confer susceptibility to familial HP in Mexicans. ",2014
24498086,['DPB1*13:01'],Association of HLA-DPB1 with scleroderma and its clinical features in Chinese population.,PloS one,"DictElement({'Volume': '9', 'Issue': '1', 'PubDate': {'Year': '2014'}}, attributes={'CitedMedium': 'Internet'})","Human leukocyte antigen DPB1 was reported to contain singly nucleotide polymorphisms conferring the strongest susceptibility to systemic sclerosis in Korean population. However, associations of specific DPB1 alleles with SSc vary in different ethnic populations. The aim of this study was to profile DPB1 alleles in Chinese population and to identify specific DPB1 alleles in association with SSc and clinical and serological features of SSc in Han Chinese. A cohort containing 338 patients with SSc and 480 gender-matched and unrelated controls were examined in the study. The HLA-DPB1 genotyping was performed with sequence-based typing method. Exact p-values were obtained (Fisher's test) from 2×2 tables of allele counts or allele carriers and disease status. Thirty eight DPB1 alleles were found in the cohort. DPB1*05:01 was the most common allele in this cohort. DPB1*03:01 and *13:01 were significantly increased in SSc. DPB1*13:01 association had already been described in other ethnic populations, whereas DPB1*03:01 was specific to Han Chinese patients with SSc. In addition, comparisons between SSc subsets indicated that patients carrying DPB1*03:01 were more likely to develop pulmonary fibrosis, DPB1*04 carriers were increased in SSc patients with anti-centromere autoantibodies and in contrast, SSc patients with homozygous DPB1*05:01 showed an opposite association with marginal significance. ",2014
24498373,['DRB1*13:02'],Human leukocyte antigens and systemic lupus erythematosus: a protective role for the HLA-DR6 alleles DRB1*13:02 and *14:03.,PloS one,"DictElement({'Volume': '9', 'Issue': '2', 'PubDate': {'Year': '2014'}}, attributes={'CitedMedium': 'Internet'})","Many studies on associations between human leukocyte antigen (HLA) allele frequencies and susceptibility to systemic lupus erythematosus (SLE) have been performed. However, few protective associations with HLA-DRB1 alleles have been reported. Here, we sought protective, as well as predispositional, alleles of HLA-DRB1 in Japanese SLE patients. An association study was conducted for HLA-DRB1 in Japanese SLE patients. Relative predispositional effects were analyzed by sequential elimination of carriers of each allele with the strongest association. We also explored the association of DRB1 alleles with SLE phenotypes including the presence of autoantibody and clinical manifestations. Significantly different carrier frequencies of certain DRB1 alleles were found to be associated with SLE as follows: increased DRB1*15:01 (P = 5.48×10⁻¹⁰, corrected P (Pc) = 1.59×10⁻⁸, odds ratio [OR] 2.17, 95% confidence interval [CI] 1.69-2.79), decreased DRB1*13:02 (P = 7.17×10⁻⁵, Pc = 0.0020, OR 0.46, 95% CI 0.34-0.63) and decreased DRB1*14:03 (P = 0.0010, Pc = 0.0272, OR 0.34, 95% CI 0.18-0.63). Additionally, the ""*15:01/*13:02 or *14:03"" genotype tended to be negatively associated with SLE (P = 0.4209, OR 0.66), despite there being significant positive associations with *15:01 when present together with alleles other than *13:02 or *14:03 (P = 1.79×10⁻¹¹, OR 2.39, 95% CI 1.84-3.10). This protective effect of *13:02 and *14:03 was also confirmed in SLE patients with different clinical phenotypes. To the best of our knowledge, this is the first report of a protective association between the carrier frequencies of HLA-DRB1*13:02 and *14:03 and SLE in the Japanese population.",2014
24911054,['DRB1*13:02'],Protective effect of the HLA-DRB1*13:02 allele in Japanese rheumatoid arthritis patients.,PloS one,"DictElement({'Volume': '9', 'Issue': '6', 'PubDate': {'Year': '2014'}}, attributes={'CitedMedium': 'Internet'})","Rheumatoid arthritis (RA) is a chronic systemic inflammatory disease. Certain HLA-DRB1 ""shared-epitope"" alleles are reported to be positively associated with increased RA susceptibility, whereas some of the other alleles may be negatively associated. However, studies on the latter are rare. Here, we focus on the protective effects of DRB1 alleles in Japanese RA patients in an association study. Relative predispositional effects (RPE) were analyzed by sequential elimination of carriers of each allele with the strongest association. The protective effects of DRB1 alleles were investigated in patients stratified according to whether they possessed anti-citrullinated peptide antibodies (ACPA). The DRB1*13:02 allele was found to be negatively associated with RA (P = 4.59×10(-10), corrected P (Pc) = 1.42×10(-8), odds ratio [OR] 0.42, 95% CI 0.32-0.55, P [RPE] = 1.27×10(-6)); the genotypes DRB1*04:05/*13:02 and *09:01/*13:02 were also negatively associated with RA. The protective effect of *13:02 was also present in ACPA-positive patients (P = 3.95×10(-8), Pc = 1.22×10(-6), OR 0.42, 95%CI 0.31-0.58) whereas *15:02 was negatively associated only with ACPA-negative RA (P = 8.87×10(-5), Pc = 0.0026, OR 0.26, 95%CI 0.12-0.56). Thus, this study identified a negative association of DRB1*13:02 with Japanese RA; our findings support the protective role of DRB1*13:02 in the pathogenesis of ACPA-positive RA.",2014
25346274,"['DRB1*13:01', 'DRB1*11:01']",HLA-DRB1*13:01 allele in the genetic susceptibility to colorectal carcinoma.,International journal of cancer,"DictElement({'Volume': '136', 'Issue': '10', 'PubDate': {'Year': '2015', 'Month': 'May', 'Day': '15'}}, attributes={'CitedMedium': 'Internet'})","Increasing evidence suggests that HLA-DRB1 alleles reduce or increase the risk of developing ulcerative colitis-associated colorectal carcinoma (CRC) tumors. However, the role of HLA-DRB1 locus on the susceptibility to develop CRC tumor, in the absence of a history of inflammatory bowel diseases (IBDs), is unclear. The aim of our study was to determine whether HLA-DRB1 alleles are associated with IBD-independent CRC tumor. HLA-DRB1 allele polymorphisms were identified by sequence-based typing method in 53 CRC patients and 57 sex- and age-matched healthy Caucasian controls. Pearson's chi-squared analysis with Yate's correction or Fisher's exact test with Bonferroni's correction, as appropriate, were used to compare the allele frequency (AF) differences of HLA-DRB1 in patients and controls. A total of 29 HLA-DRB1 alleles were recognized. A detailed study of these alleles allowed to identify DRB1*13:01 and DRB1*11:01 alleles that were significantly associated with an increased and reduced risk to develop CRC tumor, respectively. AF of DRB1*13:01, in CRC patients, was significantly higher than that of healthy controls, even following Bonferroni's correction (p = 0.029). In contrast, the presence of the DRB1*11:01 allele was negatively associated with CRC tumor as evidenced by the significantly lower AF in CRC patients than that of healthy controls (p = 0.005). However, following Bonferroni's correction, the AF of DRB*11:01 lost its statistical significance. These results suggest that HLA-DRB1*13:01 allele could be a potential marker for predicting genetic susceptibility to CRC tumor. In contrast, the protective role of DRB1*11:01 remains unclear.",2015
