pubmedID,allele,Title,JournalName,JournalIssue,Abstract,Year
28506627,['DPB1*09:01'],RXRB Is an MHC-Encoded Susceptibility Gene Associated with Anti-Topoisomerase I Antibody-Positive Systemic Sclerosis.,The Journal of investigative dermatology,"DictElement({'Volume': '137', 'Issue': '9', 'PubDate': {'Year': '2017', 'Month': '09'}}, attributes={'CitedMedium': 'Internet'})","Systemic sclerosis is a systemic autoimmune and connective tissue disorder associated with the human leukocyte antigen locus. However, the functional relationship between human leukocyte antigen gene(s) and disease development remains unknown. To elucidate major histocompatibility complex-linked systemic sclerosis genetics, we performed genotyping of major histocompatibility complex-borne microsatellites and HLA-DPB1 alleles using DNA obtained from 318 anti-topoisomerase I antibody-positive patients and 561 healthy controls, all of Japanese descent. Those results revealed two major histocompatibility complex haplotypes associated with systemic sclerosis. Exome sequencing and targeted analysis of these risk haplotypes identified rs17847931 in RXRB as a susceptibility variant (P = 1.3 × 10<sup>-15</sup>; odds ratio [OR] = 9.4) with amino acid substitution p.V95A on the risk haplotype harboring HLA-DPB1∗13:01. No identical variant in the other haplotype including DPB1*09:01 was observed, though that haplotype also showed a significant association (P = 8.5 × 10<sup>-22</sup>; OR = 4.3) with systemic sclerosis. Furthermore, the number of risk factors was shown to be a predominant factor, as individuals with two factors had elevated risk (P = 6.7 × 10<sup>-13</sup>; OR = 30.2). We concluded that RXRB may be involved in antifibrotic activity in skin and chromatin remodeling.",2017
28624488,"['DQB1*03:03', 'DQB1*05:01', 'DQB1*05:03']",Association between HLA-DQB1 alleles and susceptibility to coronary artery disease in Southern Han Chinese.,Human immunology,"DictElement({'Volume': '78', 'Issue': '9', 'PubDate': {'Year': '2017', 'Month': 'Sep'}}, attributes={'CitedMedium': 'Internet'})","Accumulated evidence indicates that polymorphisms in human leukocyte antigens (HLA) are associated with susceptibility to coronary artery disease (CAD). However, whether HLA-DQB1 alleles are correlated with susceptibility to CAD is unclear. In this study, significantly lower frequencies of the allele groups (DQB1*03:01:01G and DQB1*05:03:01G) and the genotypes (DQB1*03:01:01G/DQB1*03:01:01G and DQB1*03:01:01G/DQB1*05:03:01G) were observed in the CAD group compared with that in the controls. However, notably higher frequencies of DQB1*04:01:01G and genotype DQB1*05:01:01G/DQB1*03:01:01G were observed in the CAD patients than in the controls. Further analysis in subgroups showed that DQB1*03:01:01G was present at a significantly lower frequency in both female and male CAD patients compared with the corresponding controls; however, DQB1*04:01:01G was overtly high only in male CAD patients. CAD patients with diabetes showed a negative association with DQB1*03:01:01G and DQB1*05:03:01G and a positive association with DQB1*04:01:01G, DQB1*03:02:01G and DQB1*03:03:02G. Results of logistic regression analysis indicated that DQB1*03:01:01G and DQB1*05:03:01G were significantly associated with reduced susceptibility to CAD, but DQB1*04:01:01G, DQB1*03:02:01G and DQB1*03:03:02G had no correlation with CAD. Together, these findings indicate that CAD in Southern Han Chinese is negatively associated with HLA-DQB1*03:01:01G and DQB1*05:03:01G, and males with HLA-DQB1*04:01:01G are likely to have high risk for CAD.",2017
28894202,['DQB1*06:04'],"Principal contribution of HLA-DQ alleles, DQB1*06:04 and DQB1*03:01, to disease resistance against primary biliary cholangitis in a Japanese population.",Scientific reports,"DictElement({'Volume': '7', 'Issue': '1', 'PubDate': {'Year': '2017', 'Month': '09', 'Day': '11'}}, attributes={'CitedMedium': 'Internet'})","Identification of the primary allele(s) in HLA class II associated diseases remains challenging because of a tight linkage between alleles of HLA-DR and -DQ loci. In the present study, we determined the genotypes of seven HLA loci (HLA-A, -B, -DRB1, -DQA1, -DQB1, -DPA1 and -DPB1) for 1200 Japanese patients with primary biliary cholangitis and 1196 controls. Observation of recombination derivatives facilitated an evaluation of the effects of individual HLA alleles consisting of disease-prone/disease-resistant HLA haplotypes. Consequently, a primary contribution of DQB1*06:04 (odds ratio: 0.19, p = 1.91 × 10<sup>-22</sup>), DQB1*03:01 (odds ratio: 0.50, p = 6.76 × 10<sup>-10</sup>), DRB1*08:03 (odds ratio: 1.75, p = 1.01 × 10<sup>-7</sup>) and DQB1*04:01 (odds ratio: 1.50, p = 9.20 × 10<sup>-6</sup>) was suggested. Epistasis of the protective DQB1*06:04 to risk conferred by DRB1*08:03 was demonstrated by subpopulation analysis, implicating the presence of an active immunological mechanism that alleviates pathogenic autoimmune reactions. Further, the contribution of the aforementioned HLA alleles as well as an HLA-DP allele, DPB1*02:01 to the association signals of 304 loci among 4103 SNPs in the HLA region at the genome-wide level of significance (p values less than 5 × 10<sup>-8</sup>) was demonstrated by the stepwise exclusion of the individuals possessing these HLA alleles from the comparison.",2017
29362509,['DRB1*15:03'],"Structure-based selection of human metabolite binding P4 pocket of DRB1*15:01 and DRB1*15:03, with implications for multiple sclerosis.",Genes and immunity,"DictElement({'Volume': '20', 'Issue': '1', 'PubDate': {'Year': '2019', 'Month': '01'}}, attributes={'CitedMedium': 'Internet'})","Binding of small molecules in the human leukocyte antigen (HLA) peptide-binding groove may result in conformational changes of bound peptide and an altered immune response, but previous studies have not considered a potential role for endogenous metabolites. We performed virtual screening of the complete Human Metabolite Database (HMDB) for docking to the multiple sclerosis (MS) susceptible DRB1*15:01 allele and compared the results to the closely related yet non-susceptible DRB1*15:03 allele; and assessed the potential impact on binding of human myelin basic peptide (MBP). We observed higher energy scores for metabolite binding to DRB1*15:01 than DRB1*15:03. Structural comparison of docked metabolites with DRB1*15:01 and DRB1*15:03 complexed with MBP revealed that Phenylalanine<sup>MBP92</sup> allows binding of metabolites in the P4 pocket of DRB1*15:01 but Valine<sup>MBP89</sup> abrogates metabolite binding in the P1 pocket. We observed differences in the energy scores for binding of metabolites in the P4 pockets of DRB1*15:01 vs. DRB1*15:03 suggesting stronger binding to DRB1*15:01. Our study confirmed that specific, disease-associated human metabolites bind effectively with the most polymorphic P4 pocket of DRB1*15:01, the primary MS susceptible allele in most populations. Our results suggest that endogenous human metabolites bound in specific pockets of HLA may be immunomodulatory and implicated in autoimmune disease.",2019
29603038,['DQB1*05:01'],Associations of CTLA4 +49 A/G Dimorphism and HLA-DRB1*/DQB1* Alleles With Type 1 Diabetes from South India.,Biochemical genetics,"DictElement({'Volume': '56', 'Issue': '5', 'PubDate': {'Year': '2018', 'Month': 'Oct'}}, attributes={'CitedMedium': 'Internet'})","The aim of present study was to elucidate the association of CTLA4 +49 A/G and HLA-DRB1*/DQB1* gene polymorphism in south Indian T1DM patients. The patients and controls (n = 196 each) were enrolled for CTLA4 and HLA-DRB1*/DQB1* genotyping by RFLP/PCR-SSP methods. The increased frequencies of CTLA4 'AG' (OR = 1.99; p = 0.001), 'GG' (OR = 3.94; p = 0.001) genotypes, and 'G' allele (OR = 2.42; p = 9.26 × 10<sup>-8</sup>) were observed in patients. Reduced frequencies of 'AA' (OR = 0.35; p = 7.19 × 10<sup>-7</sup>) and 'A' (OR = 0.41; p = 9.26 × 10<sup>-8</sup>) in patients revealed protective association. Among HLA-DRB1*/DQB1* alleles, DRB1*04 (OR = 3.29; p = 1.0 × 10<sup>-5</sup>), DRB1*03 (OR = 2.81; p = 1.9 × 10<sup>-6</sup>), DQB1*02:01 (OR = 2.93; p = 1.65 × 10<sup>-5</sup>), DQB1*02:02 (OR = 3.38; p = 0.0003), and DQB1*03:02 (OR = 7.72; p = 0.0003) were in susceptible association. Decreased frequencies of alleles, DRB1*15 (OR = 0.32; p = 2.55 × 10<sup>-7</sup>), DRB1*10 (OR = 0.45; p = 0.002), DQB1*06:01 (OR = 0.43; p = 0.0001), and DQB1*05:02 (OR = 0.28; p = 2.1 × 10<sup>-4</sup>) in patients were suggested protective association. The combination of DRB1*03+AG (OR = 5.21; p = 1.4 × 10<sup>-6</sup>), DRB1*04+AG (OR = 2.14; p = 0.053), DRB1*04+GG (OR = 5.21; p = 0.036), DQB1*02:01+AG (OR = 4.44; p = 3.6 × 10<sup>-5</sup>), DQB1*02:02+AG (OR = 20.9; p = 9.5 × 10<sup>-4</sup>), and DQB1*02:02+GG (OR = 4.06; p = 0.036) revealed susceptible association. However, the combination of DRB1*10+AA (OR = 0.35; p = 0.003), DRB1*15+AA (OR = 0.22; p = 5.3 × 10<sup>-7</sup>), DQB1*05:01+AA (OR = 0.45; p = 0.007), DQB1*05:02+AA (OR = 0.17; p = 1.7 × 10<sup>-4</sup>), DQB1*06:01+AA (OR = 0.40; p = 0.002), and DQB1*06:02+AG (OR = 0.34; p = 0.001) showed decreased frequency in patients, suggesting protective association. In conclusion, CTLA4/HLA-DR/DQ genotypic combinations revealed strong susceptible/protective association toward T1DM in south India. A female preponderance in disease associations was also documented.",2018
29691938,['DRB1*15:03'],HLA-DRB1*15:03 and HLA-DRB1*11: useful predictive alleles for alloantibody production in thalassemia patients.,"Transfusion medicine (Oxford, England)","DictElement({'Volume': '29', 'Issue': '3', 'PubDate': {'Year': '2019', 'Month': 'Jun'}}, attributes={'CitedMedium': 'Internet'})","Recently, thalassemia has been introduced as a chronic disease. In spite of prolonging life in thalassemia patients, the quality of their life has not significantly improved. One of the challenges that makes their quality of life poor is alloimmunisation which causes several complications to patients by restricting their options. Some individuals are more susceptible to developing an alloantibody than others. They are categorised as responders and non-responders. Determining responders before the first transfusion allows transfusion services to provide compatible blood and prevent alloimmunisation. The aim of the present study was to determine the relationship between HLA-DRB1*15:03, HLA-DRB1*11 and HLA-DRB1*09:01 alleles and alloimmunisation in Iranian thalassemia patients.",2019
30085094,['DRB1*15:03'],Genetic fine mapping of systemic lupus erythematosus MHC associations in Europeans and African Americans.,Human molecular genetics,"DictElement({'Volume': '27', 'Issue': '21', 'PubDate': {'Year': '2018', 'Month': '11', 'Day': '01'}}, attributes={'CitedMedium': 'Internet'})","Genetic variation within the major histocompatibility complex (MHC) contributes substantial risk for systemic lupus erythematosus, but high gene density, extreme polymorphism and extensive linkage disequilibrium (LD) have made fine mapping challenging. To address the problem, we compared two association techniques in two ancestrally diverse populations, African Americans (AAs) and Europeans (EURs). We observed a greater number of Human Leucocyte Antigen (HLA) alleles in AA consistent with the elevated level of recombination in this population. In EUR we observed 50 different A-C-B-DRB1-DQA-DQB multilocus haplotype sequences per hundred individuals; in the AA sample, these multilocus haplotypes were twice as common compared to Europeans. We also observed a strong narrow class II signal in AA as opposed to the long-range LD observed in EUR that includes class I alleles. We performed a Bayesian model choice of the classical HLA alleles and a frequentist analysis that combined both single nucleotide polymorphisms (SNPs) and classical HLA alleles. Both analyses converged on a similar subset of risk HLA alleles: in EUR HLA- B*08:01 + B*18:01 + (DRB1*15:01 frequentist only) + DQA*01:02 + DQB*02:01 + DRB3*02 and in AA HLA-C*17:01 + B*08:01 + DRB1*15:03 + (DQA*01:02 frequentist only) + DQA*02:01 + DQA*05:01+ DQA*05:05 + DQB*03:19 + DQB*02:02. We observed two additional independent SNP associations in both populations: EUR rs146903072 and rs501480; AA rs389883 and rs114118665. The DR2 serotype was best explained by DRB1*15:03 + DQA*01:02 in AA and by DRB1*15:01 + DQA*01:02 in EUR. The DR3 serotype was best explained by DQA*05:01 in AA and by DQB*02:01 in EUR. Despite some differences in underlying HLA allele risk models in EUR and AA, SNP signals across the extended MHC showed remarkable similarity and significant concordance in direction of effect for risk-associated variants.",2018
30092016,"['DQB1*05:03', 'DRB1*11:01']","An original Eurasian haplotype, HLA-DRB1*14:54-DQB1*05:03, influences the susceptibility to idiopathic achalasia.",PloS one,"DictElement({'Volume': '13', 'Issue': '8', 'PubDate': {'Year': '2018'}}, attributes={'CitedMedium': 'Internet'})","Idiopathic achalasia is a relatively infrequent esophageal motor disorder for which major histocompatibility complex (MHC) genes are well-identified risk factors. However, no information about HLA-achalasia susceptibility in Mexicans has previously been reported. We studied a group of 91 patients diagnosed with achalasia and 234 healthy controls with Mexican admixed ancestry. HLA alleles and conserved extended haplotypes were analyzed using high-resolution HLA typing based on Sanger and next-generation sequencing technologies. Admixture estimates were determined using HLA-B and short tandem repeats. Results were analyzed by non-parametric statistical analysis and Bonferroni correction. P-values < 0.05 were considered significant. Patients with achalasia had 56.7% Native American genes, 24.7% European genes, 16.5% African genes and 2.0% Asian genes, which was comparable with the estimates in the controls. Significant increases in the frequencies of alleles DRB1*14:54 and DQB1*05:03 and the extended haplotypes DRB1*14:54-DQB1*05:03 and DRB1*11:01-DQB1*03:01, even after Bonferroni correction (pC<0.05), were found in the achalasia group compared to those in the controls. Concluding, the HLA class II alleles HLA-DRB1*14:54:01 and DQB1*05:03:01 and the extended haplotype are risk factors for achalasia in mixed-ancestry Mexican individuals. These results also suggest that the HLA-DRB1*14:54-DQB1*05:03 haplotype was introduced by admixture with European and/or Asian populations.",2018
30175673,"['DRB1*11:04', 'DRB1*13:01', 'DRB1*13:02', 'DRB1*11:01']",Human leukocyte antigen (HLA)-DRB1 allele polymorphisms and systemic sclerosis.,Modern rheumatology,"DictElement({'Volume': '29', 'Issue': '6', 'PubDate': {'Year': '2019', 'Month': 'Nov'}}, attributes={'CitedMedium': 'Internet'})","<b>Objectives:</b> Human leukocyteantigen (HLA) is the most important gene for immune system regulation. Although studies have evaluated the association between HLA-DRB1 allele polymorphisms and systemic sclerosis (SSc), their results are still controversial. We performed a meta-analysis to assess the association of HLA-DRB1 alleles with risk of SSc.<b>Methods:</b> Electronic database were systematically searched for articles, a total of 11 case-control studies including 3268 cases and 5548 controls were analyzed. Odds ratio (ORs) and 95% confidence intervals were used to assess the association of HLA-DRB1 alleles with SSc. The relationship between SSc-related autoantibodies and DRB1 alleles was also analyzed.<b>Results:</b> In the overall analysis, four alleles (DRB1*04:03, DRB1*08, DRB1*11, and DRB1*11:04) increased the risk of SSc; however, five alleles (DRB1*07, DRB1*11:01, DRB1*13, DRB1*13:01, and DRB1*14) had the opposite effect. Analysis of subgroups by ethnicity indicate that DRB1*11:01 and DRB1*13:01 confer a protective effect in Caucasians, while DRB1*11:04 was associated with a higher risk of SSc. For Asian, DRB1*13:02 was found to be a protective factor. In addition, the frequency of DRB1*11:04 alleles was significantly increased in ATA<sup>+</sup> SSc patients compared with ATA<sup>-</sup> SSc patients.<b>Conclusion:</b> DRB1*04:03, DRB1*08, DRB1*11, and DRB1*11:04 were associated with the risk of SSc. Additionally, DRB1*11 and DRB1*11:04 were association with ATAs.",2019
30352277,"['DQB1*06:04', 'DRB1*13:02']","Protective association of HLA-DRB1*13:02, HLA-DRB1*04:06, and HLA-DQB1*06:04 alleles with cervical cancer in a Korean population.",Human immunology,"DictElement({'Volume': '80', 'Issue': '2', 'PubDate': {'Year': '2019', 'Month': 'Feb'}}, attributes={'CitedMedium': 'Internet'})","Human leukocyte antigen (HLA) class II alleles have been previously associated with cervical cancer. However, these associations vary widely across racial and ethnic groups. Therefore, we evaluated the effect of HLA class II alleles on cervical cancer in a Korean population. HLA-DRB1, HLA-DQB1, and HLA-DQA1 alleles were analyzed in 457 cervical cancer patients and compared to those of 926 control subjects. The odds ratio (OR) of each allele between the patients and controls was calculated using the logistic regression model. Patients, had significantly lower frequencies of HLA-DRB1 and HLA-DQB1 alleles than control subjects: HLA-DRB1*13:02:01 (4.4% vs 8.8%; OR 0.48, 95% confidence interval (CI) 0.27-0.84; p = 0.001), HLA-DRB1*04:06 (2.1% vs 4.7%; OR 0.44, 95% CI 0.20-0.97; p = 0.033), and HLA-DQB1*06:04:01 (2.3% vs 5.0%; OR 0.46, 95% CI 0.22-0.94; p = 0.021). No significant association was observed for HLA-DQA1. Protective associations between HLA-DRB1*13:02, HLA-DRB1*04:06, and HLA-DQB1*06:04 alleles and cervical cancer were found in the Korean population.",2019
31254396,['DRB1*11:01'],"Association of HLA-DQB1*03:01 and DRB1*11:01 with spontaneous clearance of hepatitis C virus in Chinese Li ethnicity, an ethnic group genetically distinct from Chinese Han ethnicity and infected with unique HCV subtype.",Journal of medical virology,"DictElement({'Volume': '91', 'Issue': '10', 'PubDate': {'Year': '2019', 'Month': '10'}}, attributes={'CitedMedium': 'Internet'})","Specific human leukocyte antigen (HLA) class I and class II alleles have been associated with spontaneous clearance or persistent infection of hepatitis C virus (HCV), which seemed to be restricted by the host's ethnicity and viral genotype. Recently we reported a high prevalence and spontaneous clearance rate of HCV in a cohort of Chinese Li ethnicity who were infected with new variants of HCV genotype 6. In this study, we found that the distribution of HLA class I and class II alleles in HCV infected individuals of Chinese Li ethnicity (n = 143) was distinct from that of Chinese Han ethnicity which was reported in our previous study. HLA-DRB1*11:01 and DQB1*03:01 were more prevalent in Chinese Li subjects who cleared HCV spontaneously than those who were chronically infected (P = .036 and P = .024, respectively), which were consistent with our previous report regarding the Chinese Han population. Multivariate logistic regression analysis showed that DQB1*03:01 (odds ratio = 3.899, P = .017), but not DRB1*11:01, associated with HCV spontaneous clearance, independent of age, sex, and IFNL3 genotype. Because DQB1*03:01 and DRB1*11:01 were tightly linked because of linkage disequilibrium, our results clearly supported the associations of these two alleles with HCV spontaneous clearance in Chinese Li as well as Han ethnicity.",2019
31521393,['DRB1*11:01'],A single center study of protective and susceptible HLA alleles and haplotypes with end-stage renal disease in China.,Human immunology,"DictElement({'Volume': '80', 'Issue': '11', 'PubDate': {'Year': '2019', 'Month': 'Nov'}}, attributes={'CitedMedium': 'Internet'})","Chronic kidney disease (CKD) is becoming a global public health problem and usually cause End-Stage Renal Disease (ESRD) in the end of progression. To analyze the associations of HLA-A, -B, -C, -DRB1 and -DQB1 alleles at high resolution with ESRD in Jiangsu province of China, a total of 499 unrelated patients with ESRD from the First Affiliated Hospital with Nanjing Medical University and 1584 healthy controls from Jiangsu Branch of Chinese Marrow Donor Program (CMDP) were genotyped at HLA-A, -B, -C, -DRB1 and -DQB1 loci. Statistical analysis was applied to compare the differences of HLA allele frequencies between patients with ESRD and healthy controls. As results, no protective allele at A locus was found and the susceptible alleles were A*11:01 and A*31:01. At B locus, B*15:01, B*55:02 and B*39:05 emerged as susceptible alleles, whereas no protective allele was found. At C locus, C*06:02 and C*07:01 emerged as protective alleles and no susceptible allele was found. At DRB1 locus, six alleles including DRB1*03:01, DRB1*04:03, DRB1*04:04, DRB1*04:05, DRB1*11:01 and DRB1*12:02 emerged as susceptible alleles, while DRB1*15:01 emerged as a protective allele. At DQB1 locus, DQB1*02:01, DQB1*03:01, DQB1*03:02 and DQB1*04:01 emerged as susceptible alleles, while DQB1*06:02 and DQB1*06:09 emerged as protective alleles. Haplotype A*11:01-C*03:03-B*15:01-DRB1*11:01-DQB1*03:01 containing four susceptible alleles was regarded as the most susceptible haplotype. The susceptible alleles and haplotypes might be used as some important risk classification markers. Besides, in the consanguineous renal transplantation, it would be very beneficial for the long-term survival of renal transplant patients to avoid the susceptible alleles and haplotypes in selecting optimal donors.",2019
31810856,['DPB1*17:01'],Fine mapping of the MHC region identifies major independent variants associated with Han Chinese primary biliary cholangitis.,Journal of autoimmunity,"DictElement({'Volume': '107', 'PubDate': {'Year': '2020', 'Month': '02'}}, attributes={'CitedMedium': 'Internet'})","The genetic association of primary biliary cholangitis with major histocompatibility complex (MHC) has been widely confirmed among different ethnicities. To map specific MHC region variants associated with PBC in a Han Chinese cohort, we imputed HLA antigens and amino acids (AA) in 1126 PBC cases and 1770 healthy control subjects using a Han-MHC reference database. We demonstrate that HLA-DRB1 and/or HLA-DQB1 contributed the strongest signals, and that HLA-DPB1 was a separate independent locus. Regression analyses with classical HLA alleles indicate that HLA-DQB1*03:01 or HLA-DQβ1-Pro55, HLA-DPB1*17:01 or HLA-DPβ1-Asp84 and HLA-DRB1*08:03 could largely explain MHC association with PBC. Forward stepwise regression analyses with HLA amino acid variants localize the major signals to HLA-DRβ1-Ala74, HLA-DQβ1-Pro55 and HLA-DPβ1-Asp84. Electrostatic potential calculations implicated AA variations at HLA-DQβ1 position 55 and HLA-DPβ1 position 84 as critical to peptide binding properties. Furthermore, although several critical Han Chinese AA variants differed from those shown in European populations, the predicted effects on antigen binding are likely to be very similar or identical and underlie the major component of MHC association with PBC.",2020
32183601,"['DRB1*10:01', 'DRB1*11:01']",Breast Cancer Is Associated with Increased HLA-DRB1*11:01 and HLA-DRB1*10:01 Allele Frequency in a Population of Patients from Central Italy.,Immunological investigations,"DictElement({'Volume': '49', 'Issue': '5', 'PubDate': {'Year': '2020', 'Month': 'Jul'}}, attributes={'CitedMedium': 'Internet'})","The relationship between HLA-DRB1 allele polymorphism and breast cancer (BC) development is still unclear and needs further investigation. To address this issue, we analyzed HLA-DRB1 allele frequency (AF) by sequence-based typing (SBT) in 47 patients from central Italy with BC and 156 sex and age-matched healthy controls. Two hundred ninety-seven individuals from the same region were utilized as historical controls. Pearson's chi-square analysis with Yate's correction or Fisher's Exact test with Bonferroni's correction, as appropriate, were used to compare HLA-DRB1 AF differences in patients and controls. A total of 36 HLA-DRB1 alleles were identified. A detailed study showed that HLA-DRB1*11:01 and HLA-DRB1*10:01 alleles are significantly associated with increased BC risk. In particular, HLA-DRB1*11:01 AF was significantly higher in patients with BC than in healthy females and historical controls, even following Bonferroni's correction (stage I-II BC patients vs historical controls p<0.00; stage III-IV BC patients vs female healthy controls p=0.025 and historical controls p<0.00). The HLA-DRB1*10:01 allele was also positively associated with BC as evidenced by a significantly higher AF in patients with BC than in healthy controls (BC patients stage I-II vs historical controls corrected p =0.01). These results suggest that both HLA-DRB1*11:01 and HLA-DRB1*10:01 AF could represent interesting markers in patients at risk of developing BC.",2020
