pubmedID,allele,Title,JournalName,JournalIssue,Abstract,Year
32253422,['DRB1*11:01'],HLA loci predisposing to immune TTP in Japanese: potential role of the shared ADAMTS13 peptide bound to different HLA-DR.,Blood,"DictElement({'Volume': '135', 'Issue': '26', 'PubDate': {'Year': '2020', 'Month': '06', 'Day': '25'}}, attributes={'CitedMedium': 'Internet'})","Immune-mediated thrombotic thrombocytopenic purpura (iTTP) is a rare autoimmune disorder caused by neutralizing anti-ADAMTS13 autoantibodies. In white individuals, HLA allele DRB1*11 is a predisposing factor for iTTP, whereas DRB1*04 is a protective factor. However, the role of HLA in Asians is unclear. In this study, we analyzed 10 HLA loci using next-generation sequencing in 52 Japanese patients with iTTP, and the allele frequency in the iTTP group was compared with that in a Japanese control group. We identified the following HLA alleles as predisposing factors for iTTP in the Japanese population: DRB1*08:03 (odds ratio [OR], 3.06; corrected P [Pc] = .005), DRB3/4/5*blank (OR, 2.3; Pc = .007), DQA1*01:03 (OR, 2.25; Pc = .006), and DQB1*06:01 (OR,: 2.41; Pc = .003). The estimated haplotype consisting of these 4 alleles was significantly more frequent in the iTTP group than in the control group (30.8% vs 6.0%; Pc < .001). DRB1*15:01 and DRB5*01:01 were weak protective factors for iTTP (OR, 0.23; Pc = .076; and OR, 0.23, Pc = .034, respectively). On the other hand, DRB1*11 and DRB1*04 were not associated with iTTP in the Japanese. These findings indicated that predisposing and protective factors for iTTP differ between Japanese and white individuals. HLA-DR molecules encoded by DRB1*08:03 and DRB1*11:01 have different peptide-binding motifs, but interestingly, bound to the shared ADAMTS13 peptide in an in silico prediction model.",2020
33002571,"['DRB1*16:01', 'DRB1*13:01']",The role of HLA in Balkan endemic nephropathy.,Gene,"DictElement({'Volume': '767', 'PubDate': {'Year': '2021', 'Month': 'Jan', 'Day': '30'}}, attributes={'CitedMedium': 'Internet'})","Balkan endemic nephropathy (BEN), a progressive chronic tubulointerstitial disease, occurs in the endemic focus of Croatia in a population of about 10,000 inhabitants. One of its most peculiar characteristics is a strong association with upper tract urothelial carcinoma (UTUC). Despite a high number of studies, currently there are insufficient data about the association of BEN and HLA genes. The aim of this study was to investigate the polymorphism of HLA-A, -B, and -DRB1 alleles and haplotypes among BEN patients and to determine whether an association between HLA and BEN exists. In this study, we investigated HLA-A, -B, and -DRB1 alleles and haplotypes in a population of patients with BEN (N = 111) and matched healthy controls (N = 190). All individuals were tested by PCR-SSO and PCR-SSP methods to assess the possible contribution of HLA alleles and haplotypes to the development of/protection from BEN. Our results showed a positive association between the presence of HLA-B*35:02 and DRB1*04:02 alleles and BEN (P = 0.0179 and P = 0.0151, respectively) in contrast to the protective effect of HLA-A*01:01, B*27:05 and B*57:01 alleles (P = 0.0111, P = 0.0330 and P = 0.0318, respectively). Moreover, when BEN patients' HLA haplotypes were compared to controls, two haplotypes were associated with BEN susceptibility among Croatians (HLA-A*02:01~B*08:01~DRB1*03:01 and HLA-A*02:01~B*27:02~DRB1*16:01, P = 0.0064 and P = 0.0023, respectively), while haplotypes HLA-A*02:01~B*27:05~DRB1*01:01 and HLA-A*02:01~B*38:01~DRB1*13:01 each showed a possible protective effect (P = 0.0495). Our results point toward genetic susceptibility to BEN and observed differences in both susceptible/protective HLA profiles indicate the necessity of further studies in order to elucidate the pathogenesis of this disease.",2021
33359263,['DQB1*05:01'],HLA-DRB1* and DQB1* allele and haplotype diversity in eight tribal populations: Global affinities and genetic basis of diseases in South India.,"Infection, genetics and evolution : journal of molecular epidemiology and evolutionary genetics in infectious diseases","DictElement({'Volume': '89', 'PubDate': {'Year': '2021', 'Month': '04'}}, attributes={'CitedMedium': 'Internet'})","The distribution of HLA class-II DRB1* and DQB1* alleles/ haplotypes were studied in 438 individuals of 8 Dravidian tribal groups inhabiting the Western Ghats, south India. The HLA typing was performed by PCR-SSP method. In order to identify the 5-locus Ancestral Extended Haplotypes (AEH), the alleles of HLA-A, -B and -C loci were typed for DNAs with predominant 2-locus haplotypes. The analyses have revealed allele HLA-DRB1*15 as the most predominant allele (Lowest / Highest range: Urali, 14.81 / Malasar, 48.94), followed by the alleles DRB1*10 (Katunayakan, 1.85 / Paliyan, 48.21), DRB1*14 (Paliyan 4.46 / Katunayakan, 40.74), DRB1*12 (Mannan, 1.64 / Katunayakan, 20.37) and DRB1*03 (Mannan, 1.64 / Urali, 29.63). The most frequent DQB1* alleles were DQB1*02 (Paliyan 3.57 / Urali, 23.15), DQB1*05 (Katunayakan, 27.77 / Paliyan 84.82) and DQB1*06 (Malasar, 8.51 / Kuruman, 33.51). The most predominant two-locus haplotypes observed were DRB1*15-DQB1*05, DRB1*10-DQB1*05, DRB1*15-DQB1*06 and DRB1*04-DQB1*05. The present study of HLA immunogenetics of south Indian tribes have revealed the presence of globally shared two and 5-locus haplotypes. Many of these haplotypes were implicated in a number of diseases in south India. We observed the presence of ancestral extended haplotypes (AEHs), hitherto not reported in Indian populations such as, A*68-B*35-C*02-DRB1*15:01-DQB1*05:01, A*24-B*57-C*06-DRB1*04:01-DQB1*05:01 and A*24-B*35-C*02-DRB1*15:01-DQB1*05:02. The dendrogram based phylogenetic analyses have revealed the Caucasian affinity of Urali, palaeo-Mediterranean and Indo-European affinity of Malasar tribes. The presence of globally shared susceptible and protective haplotypes reiterated the mosaic immunogenetic fabric of south Indian tribes.",2021
33386169,"['DRB1*13:02', 'DRB1*15:02']",Critical amino acid variants in HLA-DRB1 allotypes in the development of Graves' disease and Hashimoto's thyroiditis in the Japanese population.,Human immunology,"DictElement({'Volume': '82', 'Issue': '4', 'PubDate': {'Year': '2021', 'Month': 'Apr'}}, attributes={'CitedMedium': 'Internet'})","The effects of amino acid variants encoded by human leukocyte antigen (HLA) class II on the development of Graves' disease (GD) and Hashimoto's thyroiditis (HT) have not been fully elucidated. We investigated the HLA-DRB1 genes of 243 GD patients and 82 HT patients in the Japanese population and compared the frequencies of HLA-DRB1 alleles and HLA-DRB1 amino acid variants between these patients and the Japanese populations previously reported by another institution. The frequencies of HLA-DRB1*04:05 and -DRB1*14:03 alleles were significantly higher and those of HLA-DRB1*01:01 and -DRB1*15:02 alleles were lower in GD patients than in controls. The frequencies of HLA-DRB1*08:03 and -DRB1*09:01 alleles were significantly higher and that of the HLA-DRB1*13:02 allele was lower in HT patients than in controls. A blind association analysis with all amino acid positions identified DRß9 and DRß31 for GD and DRß9, DRß13, and DRß21 for HT. The frequency of Glu-9 was significantly higher and that of Cys-9 was lower in GD patients than in controls. The frequencies of Lys-9 and Phe-13 were significantly higher in HT patients than in controls. DRß9 and DRß13 could be critical amino acid positions in the development of GD and HT.",2021
33421092,"['DPB1*17:01', 'DQB1*06:03', 'DRB1*13:01']","Behçet disease, new insights in disease associations and manifestations: a next-generation sequencing study.",Clinical and experimental immunology,"DictElement({'Volume': '204', 'Issue': '1', 'PubDate': {'Year': '2021', 'Month': '04'}}, attributes={'CitedMedium': 'Internet'})","Behçet disease is a multi-system disease associated with human leukocyte antigen (HLA) class I polymorphism. High-resolution next-generation sequencing (NGS) with haplotype analysis has not been performed previously for this disease. Sixty Egyptian patients diagnosed according to the International Study Group (ISG) criteria for Behçet disease and 160 healthy geographic and ethnic-matched controls were genotyped for HLA class I loci (HLA-A, B, C). For HLA class II loci (DRB1, DRB3/4/5, DQA1, DQB1, DPA1, DPB1), 40 control samples were genotyped. High-resolution HLA genotyping was performed using NGS and the results were analyzed. Clinical manifestations were oral ulcers (100%), genital ulcers (100%), eye (55%) and neurological (28%) and vascular involvement (35%). HLA-B*51:08 [odds ratio (OR) = 19·75, 95% confidence interval (CI) = 6·5-79; P < 0·0001], HLA-B*15:03 (OR = 12·15, 95% CI = 3·7-50·7; P < 0·0001), HLA-C*16:02 (OR = 6·53, 95% CI = 3-14; P < 0·0001), HLA-A*68:02 (OR = 3·14, 95% CI = 1·1-8·9; P < 0·01) were found to be associated with Behçet disease, as were HLA-DRB1*13:01 and HLA-DQB1*06:03 (OR = 3·39, 95% CI = 0·9-18·9; P = 0·04 for both). By contrast, HLA-A*03:01 (OR = 0·13, 95% CI = 0-0·8; P = 0·01) and HLA-DPB1*17:01 were found to be protective (OR = 0·27, 95% CI = 0·06-1·03; P = 0·02). We identified strong linkage disequilibrium between HLA-B*51:08 and C*16:02 and A*02:01 in a haplotype associated with Behçet disease. HLA-B*51:08 was significantly associated with legal blindness (OR = 2·98, 95% CI = 1·06-8·3; P = 0·01). In Egyptian Behçet patients, HLA-B*51:08 is the most common susceptibility allele and holds poor prognosis for eye involvement.",2021
33654122,"['DQB1*06:04', 'DRB1*13:02']",Importance of HBsAg recognition by HLA molecules as revealed by responsiveness to different hepatitis B vaccines.,Scientific reports,"DictElement({'Volume': '11', 'Issue': '1', 'PubDate': {'Year': '2021', 'Month': '03', 'Day': '02'}}, attributes={'CitedMedium': 'Internet'})","Hepatitis B (HB) vaccines (Heptavax-II and Bimmugen) designed based on HBV genotypes A and C are mainly used for vaccination against HB in Japan. To determine whether there are differences in the genetic background associated with vaccine responsiveness, genome-wide association studies were performed on 555 Heptavax-II and 1193 Bimmugen recipients. Further HLA imputation and detailed analysis of the association with HLA genes showed that two haplotypes, DRB1*13:02-DQB1*06:04 and DRB1*04:05-DQB1*04:01, were significantly associated in comparison with high-responders (HBsAb > 100 mIU/mL) for the two HB vaccines. In particular, HLA-DRB1*13:02-DQB1*06:04 haplotype is of great interest in the sense that it could only be detected by direct analysis of the high-responders in vaccination with Heptavax-II or Bimmugen. Compared with healthy controls, DRB1*13:02-DQB1*06:04 was significantly less frequent in high-responders when vaccinated with Heptavax-II, indicating that high antibody titers were less likely to be obtained with Heptavax-II. As Bimmugen and Heptavax-II tended to have high and low vaccine responses to DRB1*13:02, 15 residues were found in the Heptavax-II-derived antigenic peptide predicted to have the most unstable HLA-peptide binding. Further functional analysis of selected hepatitis B patients with HLA haplotypes identified in this study is expected to lead to an understanding of the mechanisms underlying liver disease.",2021
33710355,"['DPB1*04:02', 'DPB1*09:01', 'DPB1*13:01']",Variation and expression of HLA-DPB1 gene in HBV infection.,Immunogenetics,"DictElement({'Volume': '73', 'Issue': '3', 'PubDate': {'Year': '2021', 'Month': '06'}}, attributes={'CitedMedium': 'Internet'})","Hepatitis B virus (HBV) affects approximately 68 million people in China, and 10-15% of adults infected with HBV develop chronic hepatitis B, liver cirrhosis, liver failure or hepatocellular carcinoma (HCC). HLA-DPB1 gene polymorphism and expression have been shown to be associated with HBV infection susceptibility and spontaneous clearance. The aim of this study is to evaluate the role of HLA-DPB1 gene polymorphism in HBV infection. HLA-DPB1 and rs9277535 polymorphisms were investigated in 259 patients with HBV infection and 442 healthy controls (HCs) using sequence-based typing. The mRNA of HLA-DPB1 was measured by real-time polymerase chain reaction. HLA-DPB1 genes and rs9277535 polymorphisms were all associated with HBV infection in the Sichuan Han population. rs9277535A and HLA-DPB1*04:02 played a protective role against HBV infection. rs9277535G and DPB1*05:01 were associated with susceptibility to HBV infection. rs9277535GG had significantly higher HLA-DPB1 mRNA expression in the HBV infection group compared with the HC group. HLA-DPB1*05:01 and HLA-DPB1*21:01 had significantly lower mRNA expression in the HBV infection group compared with the HC group. The meta-analysis revealed that HLA-DPB1*02:01, HLA-DPB1*02:02, HAL-DPB1*04:01 and HLA-DPB1*04:02 protected against HBV infection, while HLA-DPB1*05:01, HLA-DPB1*09:01, and HLA-DPB1*13:01 were risk factors for susceptibility to HBV infection. HLA-DPB1*02:01, HLA-DPB1*02:02, and HLA-DPB1*04:01 were associated with HBV spontaneous clearance, while HLA-DPB1*05:01 was associated with chronic HBV infection. HLA-DPB1 alleles and rs9277535 have a major effect on the risk of HBV infection, and HBV infection is associated with lower HLA-DPB1 expression. HLA-DPB1 alleles have an important role in HBV susceptibility and spontaneous clearance.",2021
33929277,"['DQB1*05:01', 'DRB1*10:01']",Influence of HLA Class II Alleles and DRB1-DQB1 Haplotypes on Rheumatoid Arthritis Susceptibility and Autoantibody Status in the Chinese Han Population.,Immunological investigations,"DictElement({'PubDate': {'Year': '2021', 'Month': 'Apr', 'Day': '30'}}, attributes={'CitedMedium': 'Internet'})","Human leukocyte antigen (HLA) class II alleles are considered to play a key role in the progress of rheumatoid arthritis (RA). This study was carried out to investigate the presence of HLA class II alleles and their influence on disease risk and autoantibody status in Chinese Han patients with RA. Here, HLA-DRB1, DQB1 and DPB1 genotyping was performed in 125 RA patients and 120 healthy controls by using the next-generation sequencing (NGS). Strong positive associations were shown between high-resolution typed HLA-DRB1*04:05:01, DRB1*10:01:01, DQB1*04:01:01, DPB1*02:01:02 and RA patients. Moreover, the haplotypes HLA-DRB1*04:05:01~ DQB1*04:01:01 and HLA-DRB1*10:01:01~ DQB1*05:01:01 were found to be more frequent in RA populations than in healthy controls. These possible susceptible HLA alleles (HLA-DRB1*04:05:01, DRB1*10:01:01, DQB1*04:01:01 and DPB1*02:01:02) also showed higher frequencies in seropositive RA patients as compared to normal controls. The present study provided evidence that alleles HLA-DRB1*04:05:01, DRB1*10:01:01, DQB1*04:01:01 and DPB1*02:01:02 constituted RA risk alleles, and haplotypes HLA-DRB1*04:05:01~ DQB1*04:01:01, HLA-DRB1*10:01:01~ DQB1*05:01:01 also showed prevalence in Chinese Han patients with RA. Serological results preliminary demonstrated patients carrying RA-risk HLA alleles might elevate the serum level of anti-citrullinated protein antibodies and rheumatoid factor and affect RA progression.",2021
34211458,['DQB1*03:03'],High Resolution Haplotype Analyses of Classical HLA Genes in Families With Multiple Sclerosis Highlights the Role of HLA-DP Alleles in Disease Susceptibility.,Frontiers in immunology,"DictElement({'Volume': '12', 'PubDate': {'Year': '2021'}}, attributes={'CitedMedium': 'Internet'})","Multiple sclerosis (MS) susceptibility shows strong genetic associations with HLA alleles and haplotypes. We genotyped 11 HLA genes in 477 non-Hispanic European MS patients and their 954 unaffected parents using a validated next-generation sequencing (NGS) methodology. HLA haplotypes were assigned unequivocally by tracing HLA allele transmissions. We explored HLA haplotype/allele associations with MS using the genotypic transmission disequilibrium test (gTDT) and multiallelic TDT (mTDT). We also conducted a case-control (CC) study with all patients and 2029 healthy unrelated ethnically matched controls. We performed separate analyses of 54 extended multi-case families by reviewing transmission of haplotype blocks. The haplotype fragment including <i>DRB5*01:01:01~DRB1*15:01:01:01</i> was significantly associated with predisposition (gTDT: <i>p</i> < 2.20e-16; mTDT: <i>p</i> =1.61e-07; CC: <i>p</i> < 2.22e-16) as reported previously. A second risk allele, <i>DPB1*104:01</i> (gTDT: <i>p</i> = 3.69e-03; mTDT: <i>p</i> = 2.99e-03; CC: <i>p</i> = 1.00e-02), independent from the haplotype bearing <i>DRB1*15:01</i> was newly identified. The allele <i>DRB1*01:01:01</i> showed significant protection (gTDT: <i>p</i> = 8.68e-06; mTDT: <i>p</i> = 4.50e-03; CC: <i>p</i> = 1.96e-06). Two <i>DQB1</i> alleles, <i>DQB1*03:01</i> (gTDT: <i>p</i> = 2.86e-03; mTDT: <i>p</i> = 5.56e-02; CC: <i>p</i> = 4.08e-05) and <i>DQB1*03:03</i> (gTDT: <i>p</i> = 1.17e-02; mTDT: <i>p</i> = 1.16e-02; CC: <i>p</i> = 1.21e-02), defined at two-field level also showed protective effects. The HLA class I block, <i>A*02:01:01:01~C*03:04:01:01~B*40:01:02</i> (gTDT: <i>p</i> = 5.86e-03; mTDT: <i>p</i> = 3.65e-02; CC: <i>p</i> = 9.69e-03) and the alleles <i>B*27:05</i> (gTDT: <i>p</i> = 6.28e-04; mTDT: <i>p</i> = 2.15e-03; CC: <i>p</i> = 1.47e-02) and <i>B*38:01</i> (gTDT: <i>p</i> = 3.20e-03; mTDT: <i>p</i> = 6.14e-03; CC: <i>p</i> = 1.70e-02) showed moderately protective effects independently from each other and from the class II associated factors. By comparing statistical significance of 11 HLA loci and 19 haplotype segments with both untruncated and two-field allele names, we precisely mapped MS candidate alleles/haplotypes while eliminating false signals resulting from 'hitchhiking' alleles. We assessed genetic burden for the HLA allele/haplotype identified in this study. This family-based study including the highest-resolution of HLA alleles proved to be powerful and efficient for precise identification of HLA genotypes associated with both, susceptibility and protection to development of MS.",2021
34655711,"['DQB1*06:03', 'DQB1*05:01', 'DQB1*05:03']","Association of HLA-DRB1, DQA1 and DQB1 alleles and haplotype in Parkinson's disease from South India.",Neuroscience letters,"DictElement({'Volume': '765', 'PubDate': {'Year': '2021', 'Month': '11', 'Day': '20'}}, attributes={'CitedMedium': 'Internet'})","Parkinson's disease (PD) is a chronic, neurodegenerative motor disease exhibiting familial and sporadic forms. The present study was aimed to elucidate the association of HLA-DRB1*, DQA1* and DQB1* alleles with PD. A total of 105 PD patients and 100 healthy controls were typed by PCR-SSP method. We further carried out high-resolution genotyping for DQB1 and DQA1. Results revealed the increased frequencies of alleles DRB1*04 (OR = 2.36), DRB1* 13 (OR = 4.04), DQA1* 01:04:01 (OR = 4.51), DQB1*02:01 (OR = 2.66) and DQB1*06:03 (OR = 2.65) in PD patients suggesting susceptible associations. Further, decreased frequencies observed for alleles DRB1*10 (OR = 0.34), DRB1*15 (OR = 0.44), DQA1*04:01 (OR = 0.28), DQA1*06:01 (OR = 0.11) and HLA-DQB1*05:01 (OR = 0.37) among patients have suggested protective associations. Significant disease associations were observed for two-locus haplotype such as DRB1*13-DQB1*06:03 (OR = 11.52), DQA1*01:041-DQB1*06:03 (OR = 16.50), DQA1*01:041-DQB1*05:02 (OR = 5.38) and DQA1*04:01-DQB1*06:03 (OR = 3.027). Protective associations were observed for haplotypes DRB1*10-DQB1*05:01 (OR = 0.21), DRB1*15-DQB1*06 (OR = 0.006), DQA1*04:01-DQB1*05:01 (OR = 0.400) and DQA1*04:01-DQB1*05:03 (OR = 0.196). The critical amino acid residue analyses have revealed strong susceptible association for the residues of DQB1 alleles such as: L<sup>26</sup>, S<sup>28</sup>, K<sup>71</sup>, T<sup>71</sup> and A<sup>74</sup>, Y<sup>9</sup>, S<sup>30</sup>, D<sup>37</sup>, I<sup>37</sup>, A<sup>38</sup>, A<sup>57</sup> and S<sup>57</sup>; and for the residues of DQA1 alleles such as: C<sup>11</sup>, F<sup>61</sup>, I<sup>74</sup>, and M<sup>76</sup>. Similarly, amino acid residues such as A<sup>13</sup>, G<sup>26</sup>, Y<sup>26</sup>, A<sup>71</sup>, S<sup>74</sup>, L<sup>9</sup> and V<sup>38</sup> of HLA-DQB1 alleles and residues such as Y<sup>11</sup>, G<sup>61</sup>, S<sup>74</sup> and L<sup>76</sup> of DQA1 alleles showed protective associations. Thus, our study documented the susceptible and protective associations of DRB1*, DQB1 and DQA1 alleles and haplotypes in developing the disease and their influence on longevity of PD patients in south India.",2021
34686989,['DQB1*03:03'],"Contribution of HLA class II genes, DRB4*01:01, DRB1*07:01, and DQB1*03:03:2 to clinical features of Vitiligo disease in Iranian population.",Molecular biology reports,"DictElement({'Volume': '49', 'Issue': '1', 'PubDate': {'Year': '2022', 'Month': 'Jan'}}, attributes={'CitedMedium': 'Internet'})","Vitiligo is a multifactorial depigmentation condition, which is due to skin melanocyte destruction. Increased expression of HLA class II genes in patients with pre-lesions of Vitiligo suggests a crucial role for the participation of immune response in Vitiligo development. Recent studies progressively focused on HLA-DRB1 and DQB1 genes. In this study, we have evaluated the association and role of HLA-DRB4*01:01, -DRB1*07:01, and -DQB1*03:03:2 genes in different clinical subtypes of Vitiligo in the Iranian population.",2022
35118816,"['DPB1*09:01', 'DRB1*13:02', 'DPB1*13:01', 'DRB1*11:01', 'DRB1*15:02']",Association of HLA-DM and HLA class II genes with antibody response induced by inactivated Japanese encephalitis vaccine.,HLA,"DictElement({'Volume': '99', 'Issue': '4', 'PubDate': {'Year': '2022', 'Month': 'Apr'}}, attributes={'CitedMedium': 'Internet'})","HLA class II molecules, HLA-DR, DP and DQ, together with HLA II-like protein DM, play a dominant role in the processing and presentation of antigens, which may influence vaccine effectiveness. We previously demonstrated that variations in the HLA-DRB1, DPB1 and DQB1 genes may affect the neutralising antibody (NAb) response induced by the inactivated Japanese encephalitis vaccine (IJEV). In the present study, we genotyped HLA-DPA1, DQA1, DMA and DMB genes and used previous HLA-DRB1, DPB1 and DQB1 data to evaluate the association of these genes with IJEV-induced NAbs, at both the seroconversion and geometric mean titres (GMTs). We confirmed the seropositive association of DQB1*02:01 and NAbs (0.156 vs. 0.075, p_adj = 0.018; OR = 2.270; 95% CI = 1.285-3.999) and seronegative association of DQB1*02:02 (0.014 vs. 0.09, p_adj = 0.0002; OR = 0.130; 95% CI = 0.047-0.400). Furthermore, the DMB*01:03-DMA*01:01-DPA1*01:03-DPB1*04:01 haplotype was associated with a negative response (0.020 vs. 0.074; p_adj = 0.03; OR = 0.250; 95% CI = 0.097-0.649), whereas DRB1*15:02-DMB*01:01-DMA*01:01 was associated with a positive response (0.034 vs. 0; p_adj = 0.044). In addition, DRB1*12:02, DRB1*13:02, DPB1*04:01, DPB1*05:01, DPB1*09:01, DQA1*06:01 and DQA1*01:02 were associated with a higher GMT of NAbs, whereas DRB1*11:01, DPB1*13:01 and DQA1*05:05 were associated with a lower GMT of NAbs. In conclusion, the present study suggests that variations in the HLA-DM and HLA class II genes, as well as their combined allotypes, may influence the IJEV NAbs at seroconversion and GMT levels.",2022
